image_url,title
"https://via.placeholder.com/500x300/0066cc/ffffff?text=If%20aliens%20requested%20one%20animal%20and%20one%20plant%20from%20","If aliens requested one animal and one plant from Earth for study, what species would you send them? You Wish You Knew Sooner"
"https://via.placeholder.com/500x300/0066cc/ffffff?text=What%20was%20the%20best%20advice%20you%20received%20when%20you%20was","Incredible Story Of: What was the best advice you received when you was at your lowest?"
"https://via.placeholder.com/500x300/0066cc/ffffff?text=How%20did%20you%20first%20learn%20about%20sex%3F","This Simple Trick: How did you first learn about sex?"
"https://via.placeholder.com/500x300/0066cc/ffffff?text=What%E2%80%99s%20a%20superstition%2C%20tradition%2C%20or%20small%20ritual%20","[Photos]: What’s a superstition, tradition, or small ritual you still follow because part of you believes it actually works or might come true?"
"https://via.placeholder.com/500x300/0066cc/ffffff?text=What%E2%80%99s%20a%20superstition%2C%20tradition%2C%20or%20small%20ritual%20","30 Things About What’s a superstition, tradition, or small ritual you still follow because part of you believes it actually works or might come true? That Will Surprise You"
"https://via.placeholder.com/500x300/0066cc/ffffff?text=What%20is%20the%20most%20annoying%20thing%20a%20visitor%20has%20done","What is the most annoying thing a visitor has done in your house? That Went Viral Overnight"
"https://via.placeholder.com/500x300/0066cc/ffffff?text=What%20is%20the%20video%20you%20go%20back%20to%20whenever%20you%20need","What is the video you go back to whenever you need a laugh? That's Taking Over Social Media"
"https://via.placeholder.com/500x300/0066cc/ffffff?text=People%20who%20got%20resurrected%20via%20CPR%2C%20what%20was%20your%20","The Real Reason Behind: People who got resurrected via CPR, what was your experience being dead temporarily?"
"https://via.placeholder.com/500x300/0066cc/ffffff?text=What%E2%80%99s%20the%20creepiest%20thing%20you%E2%80%99ve%20heard%20someone%20ca","What’s the creepiest thing you’ve heard someone casually admit? That Everyone Should Know"
"https://via.placeholder.com/500x300/0066cc/ffffff?text=What's%20a%20cliche%20that%20you%20hate%20but%20secretly%20live%20by","What's a cliche that you hate but secretly live by? You Wish You Knew Sooner"
"https://via.placeholder.com/500x300/0066cc/ffffff?text=What%E2%80%99s%20the%20most%20shocking%20thing%20you%E2%80%99ve%20realised%20abo","The Secret Behind: What’s the most shocking thing you’ve realised about society when you became an ‘adult’?"
"https://via.placeholder.com/500x300/0066cc/ffffff?text=What%E2%80%99s%20the%20most%20shocking%20thing%20you%E2%80%99ve%20realised%20abo","What’s the most shocking thing you’ve realised about society when you became an ‘adult’? That Will Change Your Life"
"https://via.placeholder.com/500x300/0066cc/ffffff?text=What%20was%20your%20favorite%20candy%20as%20a%20kid%3F","Amazing Secret Of: What was your favorite candy as a kid?"
"https://via.placeholder.com/500x300/0066cc/ffffff?text=What%20was%20your%20favorite%20candy%20as%20a%20kid%3F","What was your favorite candy as a kid? You Never Knew Existed"
"https://via.placeholder.com/500x300/0066cc/ffffff?text=What%20kind%20of%20food%20brings%20you%20happiness%3F","This Will Shock You: What kind of food brings you happiness?"
"https://via.placeholder.com/500x300/0066cc/ffffff?text=What%20kind%20of%20food%20brings%20you%20happiness%3F","What kind of food brings you happiness? Experts Are Talking About"
"https://via.placeholder.com/500x300/0066cc/ffffff?text=What's%20the%20longest%20you've%20gone%20without%20any%20form%20of","Experts Don't Want You To Know: What's the longest you've gone without any form of intimacy?"
"https://via.placeholder.com/500x300/0066cc/ffffff?text=What's%20the%20longest%20you've%20gone%20without%20any%20form%20of","3 Facts About What's the longest you've gone without any form of intimacy? You Never Knew"
"https://via.placeholder.com/500x300/0066cc/ffffff?text=Which%20childhood%20memory%20do%20you%20wish%20you%20could%20exper","Incredible Story Of: Which childhood memory do you wish you could experience again as an adult?"
"https://via.placeholder.com/500x300/0066cc/ffffff?text=What%20book%20did%20everyone%20love%20that%20you%20just%20couldn't","The Real Reason Behind: What book did everyone love that you just couldn't get into?"
"https://via.placeholder.com/500x300/0066cc/ffffff?text=What's%20something%20that%20instantly%20makes%20you%20lose%20res","Unbelievable Truth Behind: What's something that instantly makes you lose respect for someone?"
"https://via.placeholder.com/500x300/0066cc/ffffff?text=What's%20something%20that%20instantly%20makes%20you%20lose%20res","Top 25 What's something that instantly makes you lose respect for someone? Moments"
"https://via.placeholder.com/500x300/0066cc/ffffff?text=What%20are%20some%20hidden%20downsides%20of%20owning%20an%20electr","What Happened Next Will Amaze You: What are some hidden downsides of owning an electric vehicle that’s not usually discussed but new buyers should know about?"
"https://via.placeholder.com/500x300/0066cc/ffffff?text=What%20are%20some%20hidden%20downsides%20of%20owning%20an%20electr","What are some hidden downsides of owning an electric vehicle that’s not usually discussed but new buyers should know about? Experts Are Talking About"
"https://via.placeholder.com/500x300/0066cc/ffffff?text=Are%20you%20satisfied%20with%20yourself%3F%20Why%20or%20why%20not%3F","This Changes Everything: Are you satisfied with yourself? Why or why not?"
"https://via.placeholder.com/500x300/0066cc/ffffff?text=What%E2%80%99s%20one%20small%20thing%20that%20can%20instantly%20ruin%20you","[Photos]: What’s one small thing that can instantly ruin your day?"
"https://via.placeholder.com/500x300/0066cc/ffffff?text=What's%20your%20biggest%20regret%3F","Scientists Discover: What's your biggest regret?"
"https://via.placeholder.com/500x300/0066cc/ffffff?text=What's%20your%20biggest%20regret%3F","What's your biggest regret? That Will Change Your Life"
"https://via.placeholder.com/500x300/0066cc/ffffff?text=What%E2%80%99s%20a%20quiet%20sign%20that%20someone%20has%20their%20act%2Flif","[Photos]: What’s a quiet sign that someone has their act/life together?"
"https://via.placeholder.com/500x300/0066cc/ffffff?text=When%20you're%20feeling%20your%20best%20and%20look%20in%20a%20mirror","Doctors Hate This: When you're feeling your best and look in a mirror, what's your most attractive feature?"
"https://via.placeholder.com/500x300/0066cc/ffffff?text=What%20was%20your%20recurring%20nightmare%20growing%20up%3F","[Pics]: What was your recurring nightmare growing up?"
"https://via.placeholder.com/500x300/0066cc/ffffff?text=What%20was%20your%20recurring%20nightmare%20growing%20up%3F","What was your recurring nightmare growing up? That Will Change Your Life"
"https://via.placeholder.com/500x300/0066cc/ffffff?text=What%E2%80%99s%20your%20sleep%20paralysis%20demon%E2%80%99s%20name%3F","People Are Going Crazy Over: What’s your sleep paralysis demon’s name?"
"https://via.placeholder.com/500x300/0066cc/ffffff?text=What%E2%80%99s%20something%20you%20didn%E2%80%99t%20realize%20was%20%E2%80%9Cvery%20Amer","This Simple Trick: What’s something you didn’t realize was “very American” until you left the U.S.?"
"https://via.placeholder.com/500x300/0066cc/ffffff?text=What%E2%80%99s%20something%20you%20didn%E2%80%99t%20realize%20was%20%E2%80%9Cvery%20Amer","Top 25 What’s something you didn’t realize was “very American” until you left the U.S.? Moments"
"https://via.placeholder.com/500x300/0066cc/ffffff?text=What%20have%20you%20noticed%20in%20life%20when%20you%20get%20older%3F","You Won't Believe: What have you noticed in life when you get older?"
"https://via.placeholder.com/500x300/0066cc/ffffff?text=What's%20something%20that%20society%20treats%20as%20*completel","What's something that society treats as *completely normal* right now that people in 100 years will definitely roast us for? That Everyone Should Know"
"https://via.placeholder.com/500x300/0066cc/ffffff?text=How%20do%20you%20distract%20yourself%20when%20someone%20close%20to","The Truth About: How do you distract yourself when someone close to you is shutting you out?"
"https://via.placeholder.com/500x300/0066cc/ffffff?text=How%20do%20you%20distract%20yourself%20when%20someone%20close%20to","How do you distract yourself when someone close to you is shutting you out? You Wish You Knew Sooner"
"https://via.placeholder.com/500x300/0066cc/ffffff?text=What%E2%80%99s%20your%20favorite%20aisle%20at%20the%20market%20%3F","What’s your favorite aisle at the market ? Experts Are Talking About"
"https://via.placeholder.com/500x300/0066cc/ffffff?text=People%20who%20ran%20into%20an%20ex%20after%20a%20period%20of%20no%20con","Top 5 People who ran into an ex after a period of no contact - how did it go? Moments"
"https://via.placeholder.com/500x300/0066cc/ffffff?text=What%E2%80%99s%20something%20positive%20going%20on%20in%20your%20life%20ri","Experts Don't Want You To Know: What’s something positive going on in your life right now?"
"https://via.placeholder.com/500x300/0066cc/ffffff?text=What%20is%20the%20most%20underrated%20and%20overlooked%20activit","Shocking Discovery: What is the most underrated and overlooked activity in life?"
"https://via.placeholder.com/500x300/0066cc/ffffff?text=If%20you%20could%20become%20an%20animal%2C%20what%20animal%20would%20y","Experts Don't Want You To Know: If you could become an animal, what animal would you want to be?"
"https://via.placeholder.com/500x300/0066cc/ffffff?text=If%20you%20could%20become%20an%20animal%2C%20what%20animal%20would%20y","If you could become an animal, what animal would you want to be? Everyone Is Obsessed With"
"https://via.placeholder.com/500x300/0066cc/ffffff?text=If%20you%20could%20become%20an%20animal%2C%20what%20animal%20would%20y","3 Reasons Why If you could become an animal, what animal would you want to be?"
"https://via.placeholder.com/500x300/0066cc/ffffff?text=How%20do%20you%20deal%20with%20clients%20who%20ghost%20you%20when%20it","The Real Reason Behind: How do you deal with clients who ghost you when it's time to pay?"
"https://via.placeholder.com/500x300/0066cc/ffffff?text=How%20do%20you%20deal%20with%20clients%20who%20ghost%20you%20when%20it","How do you deal with clients who ghost you when it's time to pay? Everyone Is Obsessed With"
"https://via.placeholder.com/500x300/0066cc/ffffff?text=What%E2%80%99s%20something%20nonsexual%20that%20gives%20you%20butterfl","What’s something nonsexual that gives you butterflies? You Never Knew Existed"
"https://via.placeholder.com/500x300/0066cc/ffffff?text=What%20weird%20fear%20did%20you%20have%20as%20a%20kid%2C%20and%20do%20you%20","Unbelievable Truth Behind: What weird fear did you have as a kid, and do you still have it now?"
"https://via.placeholder.com/500x300/0066cc/ffffff?text=What%20weird%20fear%20did%20you%20have%20as%20a%20kid%2C%20and%20do%20you%20","7 Secrets Behind What weird fear did you have as a kid, and do you still have it now?"
"https://via.placeholder.com/500x300/0066cc/ffffff?text=What%E2%80%99s%20the%20funniest%20pickup%20line%20that%20could%20actuall","People Are Going Crazy Over: What’s the funniest pickup line that could actually work?"
"https://via.placeholder.com/500x300/0066cc/ffffff?text=What%E2%80%99s%20the%20funniest%20pickup%20line%20that%20could%20actuall","Top 50 What’s the funniest pickup line that could actually work? Moments"
"https://via.placeholder.com/500x300/0066cc/ffffff?text=What%20is%20a%20weird%20flex%20you%20have%3F","Doctors Hate This: What is a weird flex you have?"
"https://via.placeholder.com/500x300/0066cc/ffffff?text=What%20do%20you%20sleep%20in%3F","Experts Don't Want You To Know: What do you sleep in?"
"https://via.placeholder.com/500x300/0066cc/ffffff?text=What%20do%20you%20sleep%20in%3F","What do you sleep in? You Never Knew Existed"
"https://via.placeholder.com/500x300/0066cc/ffffff?text=What%20would%20you%20do%20if%20someone%20is%20following%20you%3F","The Real Reason Behind: What would you do if someone is following you?"
"https://via.placeholder.com/500x300/0066cc/ffffff?text=What%E2%80%99s%20a%20food%20you%20didn%E2%80%99t%20like%20as%20a%20kid%20but%20love%20no","This Will Shock You: What’s a food you didn’t like as a kid but love now?"
"https://via.placeholder.com/500x300/0066cc/ffffff?text=What%E2%80%99s%20a%20food%20you%20didn%E2%80%99t%20like%20as%20a%20kid%20but%20love%20no","What’s a food you didn’t like as a kid but love now? That's Taking Over Social Media"
"https://via.placeholder.com/500x300/0066cc/ffffff?text=At%20what%20moment%20did%20you%20realize%20a%20certain%20someone%20d","This Will Shock You: At what moment did you realize a certain someone didn't trust you?"
"https://via.placeholder.com/500x300/0066cc/ffffff?text=What%20movie%20or%20show%20always%20cheers%20you%20up%3F","What movie or show always cheers you up? Experts Are Talking About"
"https://via.placeholder.com/500x300/0066cc/ffffff?text=What's%20something%20that%20makes%20you%20feel%20young%20again%3F","Doctors Hate This: What's something that makes you feel young again?"
"https://via.placeholder.com/500x300/0066cc/ffffff?text=What's%20something%20that%20makes%20you%20feel%20young%20again%3F","3 Facts About What's something that makes you feel young again? You Never Knew"
"https://via.placeholder.com/500x300/0066cc/ffffff?text=If%20you%20had%20to%20pin%20all%20your%20life%20problems%20on%20one%20da","The Real Reason Behind: If you had to pin all your life problems on one day, what happened that day?"
"https://via.placeholder.com/500x300/0066cc/ffffff?text=If%20you%20had%20to%20pin%20all%20your%20life%20problems%20on%20one%20da","25 Secrets Behind If you had to pin all your life problems on one day, what happened that day?"
"https://via.placeholder.com/500x300/0066cc/ffffff?text=if%20walking%20was%20the%20only%20transportation%20what%20would%20","Doctors Hate This: if walking was the only transportation what would you do?"
"https://via.placeholder.com/500x300/0066cc/ffffff?text=Remember%20the%20%E2%80%9Cbad%20kid%E2%80%9D%20from%20your%20childhood%20-%20where","What Happened Next Will Amaze You: Remember the “bad kid” from your childhood - where are they now?"
"https://via.placeholder.com/500x300/0066cc/ffffff?text=What%20phrase%20did%20a%20fictional%20character%20say%20that%20stu","Shocking Discovery: What phrase did a fictional character say that stuck in your mind?"
"https://via.placeholder.com/500x300/0066cc/ffffff?text=What%20phrase%20did%20a%20fictional%20character%20say%20that%20stu","What phrase did a fictional character say that stuck in your mind? Will Leave You Speechless"
"https://via.placeholder.com/500x300/0066cc/ffffff?text=What%20phrase%20did%20a%20fictional%20character%20say%20that%20stu","20 Things About What phrase did a fictional character say that stuck in your mind? That Will Surprise You"
"https://via.placeholder.com/500x300/0066cc/ffffff?text=What%20is%20the%20craziest%20thing%20you%20ever%20witnessed%20in%20c","This Simple Trick: What is the craziest thing you ever witnessed in church?"
"https://via.placeholder.com/500x300/0066cc/ffffff?text=What%E2%80%99s%20a%20compliment%20that%20has%20stuck%20with%20you%20and%20ca","5 Facts About What’s a compliment that has stuck with you and can instantly cheer you up when you think about it? You Never Knew"
"https://via.placeholder.com/500x300/0066cc/ffffff?text=What%20was%20the%20best%20thing%20that%20you%20ever%20heard%20someon","Unbelievable Truth Behind: What was the best thing that you ever heard someone say before they took a dirt nap. what did they say ?"
"https://via.placeholder.com/500x300/0066cc/ffffff?text=What%20was%20the%20best%20thing%20that%20you%20ever%20heard%20someon","Top 30 What was the best thing that you ever heard someone say before they took a dirt nap. what did they say ? Moments"
"https://via.placeholder.com/500x300/0066cc/ffffff?text=How%20do%20you%20become%20a%20positive%20person%3F","How do you become a positive person? That Broke The Internet"
"https://via.placeholder.com/500x300/0066cc/ffffff?text=How%20do%20you%20become%20a%20positive%20person%3F","7 Secrets Behind How do you become a positive person?"
"https://via.placeholder.com/500x300/0066cc/ffffff?text=What%20song%20is%20stuck%20in%20your%20head%20right%20now%3F","Shocking Discovery: What song is stuck in your head right now?"
"https://via.placeholder.com/500x300/0066cc/ffffff?text=You%E2%80%99re%20arrested%20but%20innocent.%20What%E2%80%99s%20the%20weirdest%20","Shocking Discovery: You’re arrested but innocent. What’s the weirdest thing the cops could find in your room that would make you look guilty?"
"https://via.placeholder.com/500x300/0066cc/ffffff?text=You%E2%80%99re%20arrested%20but%20innocent.%20What%E2%80%99s%20the%20weirdest%20","You’re arrested but innocent. What’s the weirdest thing the cops could find in your room that would make you look guilty? Will Leave You Speechless"
"https://via.placeholder.com/500x300/0066cc/ffffff?text=You%E2%80%99re%20arrested%20but%20innocent.%20What%E2%80%99s%20the%20weirdest%20","10 Reasons Why You’re arrested but innocent. What’s the weirdest thing the cops could find in your room that would make you look guilty?"
"https://via.placeholder.com/500x300/0066cc/ffffff?text=What%20are%20you%20addicted%20to%3F","3 Things About What are you addicted to? That Will Surprise You"
"https://via.placeholder.com/500x300/0066cc/ffffff?text=What%20normal%20parenting%20methods%20in%20the%2090s%20that%20woul","What normal parenting methods in the 90s that would be considered unsafe today? Experts Are Talking About"
"https://via.placeholder.com/500x300/0066cc/ffffff?text=Every%20satellite%20orbiting%20earth%20and%20who%20owns%20them%20(","Experts Don't Want You To Know: Every satellite orbiting earth and who owns them (2023)"
"https://via.placeholder.com/500x300/0066cc/ffffff?text=Every%20satellite%20orbiting%20earth%20and%20who%20owns%20them%20(","Every satellite orbiting earth and who owns them (2023) You Wish You Knew Sooner"
"https://via.placeholder.com/500x300/0066cc/ffffff?text=Releasing%20weights%20for%20FLUX.1%20Krea","Releasing weights for FLUX.1 Krea That Broke The Internet"
"https://via.placeholder.com/500x300/0066cc/ffffff?text=QUIC%20for%20the%20kernel","Amazing Secret Of: QUIC for the kernel"
"https://via.placeholder.com/500x300/0066cc/ffffff?text=QUIC%20for%20the%20kernel","QUIC for the kernel That Broke The Internet"
"https://via.placeholder.com/500x300/0066cc/ffffff?text=Ubiquiti%20launches%20UniFi%20OS%20Server%20for%20self-hosting","This Simple Trick: Ubiquiti launches UniFi OS Server for self-hosting"
"https://via.placeholder.com/500x300/0066cc/ffffff?text=Ubiquiti%20launches%20UniFi%20OS%20Server%20for%20self-hosting","Ubiquiti launches UniFi OS Server for self-hosting Experts Are Talking About"
"https://via.placeholder.com/500x300/0066cc/ffffff?text=MacBook%20Pro%20Insomnia","This Will Shock You: MacBook Pro Insomnia"
"https://via.placeholder.com/500x300/0066cc/ffffff?text=MacBook%20Pro%20Insomnia","7 Reasons Why MacBook Pro Insomnia"
"https://via.placeholder.com/500x300/0066cc/ffffff?text=Show%20HN%3A%20KubeForge%20%E2%80%93%20A%20GUI%20for%20Kubernetes%20YAMLs","The Real Reason Behind: Show HN: KubeForge – A GUI for Kubernetes YAMLs"
"https://via.placeholder.com/500x300/0066cc/ffffff?text=Show%20HN%3A%20KubeForge%20%E2%80%93%20A%20GUI%20for%20Kubernetes%20YAMLs","Show HN: KubeForge – A GUI for Kubernetes YAMLs You Never Knew Existed"
"https://via.placeholder.com/500x300/0066cc/ffffff?text=Show%20HN%3A%20KubeForge%20%E2%80%93%20A%20GUI%20for%20Kubernetes%20YAMLs","25 Things About Show HN: KubeForge – A GUI for Kubernetes YAMLs That Will Surprise You"
"https://via.placeholder.com/500x300/0066cc/ffffff?text=Gemini%20Embedding%3A%20Powering%20RAG%20and%20context%20enginee","Experts Don't Want You To Know: Gemini Embedding: Powering RAG and context engineering"
"https://via.placeholder.com/500x300/0066cc/ffffff?text=Gemini%20Embedding%3A%20Powering%20RAG%20and%20context%20enginee","Gemini Embedding: Powering RAG and context engineering That Went Viral Overnight"
"https://via.placeholder.com/500x300/0066cc/ffffff?text=Show%20HN%3A%20I%20made%20a%20website%20that%20makes%20you%20cry","The Secret Behind: Show HN: I made a website that makes you cry"
"https://via.placeholder.com/500x300/0066cc/ffffff?text=Replacing%20cron%20jobs%20with%20a%20centralized%20task%20schedu","This Simple Trick: Replacing cron jobs with a centralized task scheduler"
"https://via.placeholder.com/500x300/0066cc/ffffff?text=Show%20HN%3A%20Mcp-use%20%E2%80%93%20Connect%20any%20LLM%20to%20any%20MCP","Show HN: Mcp-use – Connect any LLM to any MCP Experts Are Talking About"
"https://via.placeholder.com/500x300/0066cc/ffffff?text=Show%20HN%3A%20Mcp-use%20%E2%80%93%20Connect%20any%20LLM%20to%20any%20MCP","15 Things About Show HN: Mcp-use – Connect any LLM to any MCP That Will Surprise You"
"https://via.placeholder.com/500x300/0066cc/ffffff?text=Many%20countries%20that%20said%20no%20to%20ChatControl%20in%202024","Experts Don't Want You To Know: Many countries that said no to ChatControl in 2024 are now undecided"
"https://via.placeholder.com/500x300/0066cc/ffffff?text=Many%20countries%20that%20said%20no%20to%20ChatControl%20in%202024","Many countries that said no to ChatControl in 2024 are now undecided Will Leave You Speechless"
"https://via.placeholder.com/500x300/0066cc/ffffff?text=Many%20countries%20that%20said%20no%20to%20ChatControl%20in%202024","Top 25 Many countries that said no to ChatControl in 2024 are now undecided Moments"
"https://via.placeholder.com/500x300/0066cc/ffffff?text=%E2%80%9CNo%20tax%20on%20tips%E2%80%9D%20is%20an%20industry%20plant","People Are Going Crazy Over: “No tax on tips” is an industry plant"
"https://via.placeholder.com/500x300/0066cc/ffffff?text=%E2%80%9CNo%20tax%20on%20tips%E2%80%9D%20is%20an%20industry%20plant","15 Reasons Why “No tax on tips” is an industry plant"
"https://via.placeholder.com/500x300/0066cc/ffffff?text=Telephone%20colophon%3A%20Or%2C%20how%20I%20overengineered%20my%20ca","This Will Shock You: Telephone colophon: Or, how I overengineered my call audio (2020)"
"https://via.placeholder.com/500x300/0066cc/ffffff?text=Telephone%20colophon%3A%20Or%2C%20how%20I%20overengineered%20my%20ca","Telephone colophon: Or, how I overengineered my call audio (2020) You Never Knew Existed"
"https://via.placeholder.com/500x300/0066cc/ffffff?text=Programmers%20aren%E2%80%99t%20so%20humble%20anymore%2C%20maybe%20becaus","People Are Going Crazy Over: Programmers aren’t so humble anymore, maybe because nobody codes in Perl"
"https://via.placeholder.com/500x300/0066cc/ffffff?text=Programmers%20aren%E2%80%99t%20so%20humble%20anymore%2C%20maybe%20becaus","3 Reasons Why Programmers aren’t so humble anymore, maybe because nobody codes in Perl"
"https://via.placeholder.com/500x300/0066cc/ffffff?text=Scientists%20and%20engineers%20craft%20radio%20telescope%20bou","50 Reasons Why Scientists and engineers craft radio telescope bound for the moon"
"https://via.placeholder.com/500x300/0066cc/ffffff?text=Secure%20boot%20certificate%20rollover%20is%20real%20but%20proba","Secure boot certificate rollover is real but probably won't hurt you Will Leave You Speechless"
"https://via.placeholder.com/500x300/0066cc/ffffff?text=Raspberry%20Pi%205%20Gets%20a%20MicroSD%20Express%20Hat","You Won't Believe: Raspberry Pi 5 Gets a MicroSD Express Hat"
"https://via.placeholder.com/500x300/0066cc/ffffff?text=Face%20it%3A%20you're%20a%20crazy%20person","Shocking Discovery: Face it: you're a crazy person"
"https://via.placeholder.com/500x300/0066cc/ffffff?text=Face%20it%3A%20you're%20a%20crazy%20person","Face it: you're a crazy person You Wish You Knew Sooner"
"https://via.placeholder.com/500x300/0066cc/ffffff?text=Face%20it%3A%20you're%20a%20crazy%20person","25 Facts About Face it: you're a crazy person You Never Knew"
"https://via.placeholder.com/500x300/0066cc/ffffff?text=Age%20verification%20doesn't%20need%20to%20be%20a%20privacy%20foot","Shocking Discovery: Age verification doesn't need to be a privacy footgun"
"https://via.placeholder.com/500x300/0066cc/ffffff?text=Age%20verification%20doesn't%20need%20to%20be%20a%20privacy%20foot","3 Reasons Why Age verification doesn't need to be a privacy footgun"
"https://via.placeholder.com/500x300/0066cc/ffffff?text=AI%20is%20a%20floor%20raiser%2C%20not%20a%20ceiling%20raiser","The Secret Behind: AI is a floor raiser, not a ceiling raiser"
"https://via.placeholder.com/500x300/0066cc/ffffff?text=AI%20is%20a%20floor%20raiser%2C%20not%20a%20ceiling%20raiser","AI is a floor raiser, not a ceiling raiser Will Leave You Speechless"
"https://via.placeholder.com/500x300/0066cc/ffffff?text=AI%20is%20a%20floor%20raiser%2C%20not%20a%20ceiling%20raiser","30 Things About AI is a floor raiser, not a ceiling raiser That Will Surprise You"
"https://via.placeholder.com/500x300/0066cc/ffffff?text=Denver%20rent%20is%20back%20to%202022%20prices%20after%2020k%20new%20u","[Photos]: Denver rent is back to 2022 prices after 20k new units hit the market"
"https://via.placeholder.com/500x300/0066cc/ffffff?text=Windows%20Directory%20Structure%20Synchronizer","This Changes Everything: Windows Directory Structure Synchronizer"
"https://via.placeholder.com/500x300/0066cc/ffffff?text=Windows%20Directory%20Structure%20Synchronizer","Windows Directory Structure Synchronizer You Never Knew Existed"
"https://via.placeholder.com/500x300/0066cc/ffffff?text=150%20years%20of%20Hans%20Christian%20Andersen","150 years of Hans Christian Andersen That Everyone Should Know"
