image_url,title
"https://b.thumbs.redditmedia.com/PE2dEnwjDuLurJKXXBes4BF71HuZryGR2n46vLpJNFg.jpg","My mom grew braided carrots"
"https://external-preview.redd.it/uybAAuxkNEnwynfdsyyaY7pYJOTk_IxS7qH92W28QXY.jpeg?width=140&amp;height=70&amp;crop=140:70,smart&amp;auto=webp&amp;s=f3ab43a28576419cd3ff8c24cab186f6432a5718","Ex-CIA Whistleblower: ""The NSA Audited The 2024 Election, Kamala Harris Won"""
"https://external-preview.redd.it/g3p_uMWiiaBLP9TjPh65SaorEq6HTgqkyVvkbczIIFk.jpeg?width=140&amp;height=93&amp;crop=140:93,smart&amp;auto=webp&amp;s=70bb749177a902886050ee57633e39784368ed05","Smithsonian removes Trump from impeachment exhibit in American History Museum"
"https://b.thumbs.redditmedia.com/jyXwa88O1TkzFVTfJMK8s6lIZT-Faa-KmZEM4Lhx3Ig.jpg","Gay Sex Prevents Abortion - Columbus, OH"
"https://b.thumbs.redditmedia.com/6dnx2xOmaSoySDZaH6s7_thIJ0MUndyehlHgCLHd-sE.jpg","A woman lost her engagement ring on a cross country trip, found a month later in husband's deodorant"
"https://a.thumbs.redditmedia.com/5j1rE4S5x1QXgbsoUKKzRi1mAz9GtD77hmB5bHY71X0.jpg","Meirl"
"https://b.thumbs.redditmedia.com/UQQKa4fov6iETR0tEoYcORNmC-CcyQlF9Zn3gf2U-Mg.jpg","Trump named in multiple documents related to Epstein sex trafficking, WSJ reports"
"https://b.thumbs.redditmedia.com/dGErlHA4iNCt6f08eHKtPU9oKAEA9fYjo9ySks1bhGs.jpg","Las Vegas voted for an Economic change and are mad that the economy changed. At least they won’t pay taxes on the 50% less tips they are receiving."
"https://b.thumbs.redditmedia.com/wSfTy5V0x0eIeINQUOGPdA9HMKj2dQHBgqoeGoJbEIg.jpg","The IASIP cast when they were young"
"https://b.thumbs.redditmedia.com/wNOQLeJnlhLK2ImkwM9FUgrSA11rsN7tq4IYTFARzpQ.jpg","Ms Rachel for The Washington Post, photographed by Natalie Keyssar."
"https://external-preview.redd.it/N29udnpjb3pzYmdmMeso-R1XNE2qBBtjnShlrNKB89JLYsyDWkYl2Rdx0Tcm.png?width=140&amp;height=140&amp;crop=140:140,smart&amp;format=jpg&amp;v=enabled&amp;lthumb=true&amp;s=264f37bdd24d64c3bb776d376723f7eb22897f4b","Scientists have discovered a giant new species of stick insect in Australia, which is over 15 inches long and researchers say may be the heaviest insect in the country."
"https://b.thumbs.redditmedia.com/tgOEcFi6v7SBIjzlwMKPW9ugklamD0Y5RMZ4a7-BFoI.jpg","It sure is :)"
"https://a.thumbs.redditmedia.com/TfZB8eCd_8VKAFqSmnLf6CP-NijZr5jeqzth_zmsof0.jpg","Chamber of Secrets for Dumbledore’s Army?"
"https://b.thumbs.redditmedia.com/NId6icvhItAejY1LttjddoYw1eW_VcIBmgfmf4LC73s.jpg","Yes. We know America really didn't vote for a pedophile. Did they?"
"https://b.thumbs.redditmedia.com/n2BgekEr4hQhhYlNQ3pT7_auhB3uMuZSpBAsINOg2Rk.jpg","Movin to the country"
"https://b.thumbs.redditmedia.com/hLHUQVntvlgtW-G7ssJE4Gnrnmo_byH3fgBNKh_NnhM.jpg","Build your exit ramp, don!"
"https://b.thumbs.redditmedia.com/HcAsPtBCcc3I17eV9bOHOcY_raK4KlsehQ7x5TwjtWc.jpg","Poor Akechi (@neggoartz)"
"https://b.thumbs.redditmedia.com/6DeGOWSnKUAN3AEfS-cGhAr4GfrQOcqqShiOwaotXpk.jpg","This describes everyone in here… minus being economists"
"https://b.thumbs.redditmedia.com/TrJYBAnU2uVr25XgJXnEqopTLlerQeE4jllgPMNEHkA.jpg","Absolute kino"
"https://b.thumbs.redditmedia.com/baDxUag5pfJHRat36FEWics56e1nd0KuL-zpGNAJles.jpg","A, E, I, O, U, and sometimes Y"
"https://external-preview.redd.it/HVdDgeOyV6nWQ5dgTnHyvn_xOVwSXvPtnln3E320D7Y.jpeg?width=140&amp;height=73&amp;crop=140:73,smart&amp;auto=webp&amp;s=b07b0538408df4bd8a08ab12b0c01a1bdbee6795","Escaped slave who became lawmaker will be first individual African American honored with statue at South Carolina State House"
"https://external-preview.redd.it/ZTZvanV1eTlrYmdmMZkVymrfpa6Rx7w-MfHhUbHowcrZ97SUo6bp5sXw4u95.png?width=140&amp;height=140&amp;crop=140:140,smart&amp;format=jpg&amp;v=enabled&amp;lthumb=true&amp;s=f95b365a2e8b7803b260fd74052f53c84a8a230e","🔥 Thirsty Manatee drinking fresh water as a guy rinses his boat off near St Pete, Florida."
"https://b.thumbs.redditmedia.com/3ShyEiG7ikPWe0wHZ2s0-YHdblMhMrrYyIWaRISSx1s.jpg","It’s his 1st bday. Congratulate him"
"https://a.thumbs.redditmedia.com/Odo8PumI_Ek_vstzp28iHicEX6-diRIFGdy_MCL4tg0.jpg","My cat Metro Boomington is a big fan of my Crocs but only when I'm wearing them"
"https://b.thumbs.redditmedia.com/A72T6JVNvmu5nWlx7zcHjcnpZSUwkFFH4f-MXUv3UNM.jpg","E-i-e-i-oh no"
"https://b.thumbs.redditmedia.com/cSa3qyQXJX6_9jUM7o12kPZhm2u4ja0SsCC1_OhF5OQ.jpg","McLaren tried to take the necessary precautions against the Rosberg selfie"
"https://external-preview.redd.it/dzBpMjJjMXJyOWdmMVuo-XoD4uOZ7bucDNhWC_nUfKYJwYjEEqnI7Tzr9QAT.png?width=140&amp;height=140&amp;crop=140:140,smart&amp;format=jpg&amp;v=enabled&amp;lthumb=true&amp;s=3b79cbc057bf0dd97740bdd93615df2fae9fbe28","Regrets ordering table side carving."
"https://external-preview.redd.it/aXRsbm1wMWJuYmdmMcRCBoEQvzCy-pVQgy2z6memiH4OT4VTR8zBvIGxyFOR.png?width=140&amp;height=140&amp;crop=140:140,smart&amp;format=jpg&amp;v=enabled&amp;lthumb=true&amp;s=1546a8df994e0827698c85c0ad0efe20daf30354","Wcgw speeding on tight city streets"
"https://external-preview.redd.it/tlH4fr9FnCYn1zwwbI3LeRfrkiKzbvdw0HblhwLI2PQ.jpeg?width=140&amp;height=93&amp;crop=140:93,smart&amp;auto=webp&amp;s=30fdfcb519f30de1f3651448ebc0de6d8adb09a4","Paramount+ loses 1.3 Million subscribers."
"https://b.thumbs.redditmedia.com/5Fh1WNMwUSj-nYAaD_ApWS4vnKIgkFJegS0-HSk7s5w.jpg","Kindness Before the Cure 💖"
"https://external-preview.redd.it/NGl4MWRtZmR0OWdmMSXr5QvVMRSNrY0OOzzA4yZCw7cDL7S__lFLJcliQpzP.png?width=140&amp;height=140&amp;crop=140:140,smart&amp;format=jpg&amp;v=enabled&amp;lthumb=true&amp;s=94fbe1c6fac57a8263d8df9468f3a1473e9cd892","You thought you chose the dog... but he chose you first ❤️"
"https://b.thumbs.redditmedia.com/UEk7K7jgOs6Jfhus0B16FV7uFtYjrMHkFANN-5KqVGA.jpg","Are you ready to become an Alpha Male? 💪😤"
"https://external-preview.redd.it/ZS1xsJFzrv6YMWslQpTasua1wwHOqLps2LcBl8OUG4c.jpeg?width=140&amp;height=73&amp;crop=140:73,smart&amp;auto=webp&amp;s=33d7041ff0a5bbbccf3ee31635c482b2f6c8b2bc","Trump increases tariff on Canada to 35%, White House says"
"https://b.thumbs.redditmedia.com/hDYbCkRGlW_nNkbwGWg9IH_H3fOrjBXITbG65CWsZgM.jpg","Is he moving in permanently?"
"https://external-preview.redd.it/dmFjcGo5aThoYmdmMa2ffpLSOvt2ajEwT3t-fiDPXPcTaI0AokEYQDgEAOs4.png?width=140&amp;height=78&amp;crop=140:78,smart&amp;format=jpg&amp;v=enabled&amp;lthumb=true&amp;s=c296a4bd99baabaa4b677beb03bcb6003b82cb21","Northernlion's vs Wubby's reaction to the Umamusume intro"
"https://external-preview.redd.it/dDR5bWI5cHNxOWdmMZUOo0SJSM5kbIpg2SrfzDD8r_ujhCorne7vxOcEVdDb.png?width=140&amp;height=120&amp;crop=140:120,smart&amp;format=jpg&amp;v=enabled&amp;lthumb=true&amp;s=88e2ef902cdbc072e334cc1db3c1c4427c84ab80","The most realistic assistant ever 😁"
"https://b.thumbs.redditmedia.com/YMMl4k3jb0AqaQjyzNQf-oSqgXQqGNFM3FVxRHMFEEg.jpg","What do you think?"
"https://external-preview.redd.it/aGo1ZDJoMTlqOWdmMZdLhmsiPLJFx224yDn2_VJaKS-QOjVgzZzeJ-rdJsA7.png?width=140&amp;height=140&amp;crop=140:140,smart&amp;format=jpg&amp;v=enabled&amp;lthumb=true&amp;s=1f974076ec0badd697e18eb5d52bd732f979a196","Why are they doing this at disneyland of all places?"
"https://b.thumbs.redditmedia.com/U7bCg0hvFKyppiVBzf7kcrveEcEuHhEkcOZlpYGkiuY.jpg","V really is built different"
"https://b.thumbs.redditmedia.com/p8szhN3yo03UE4DNiXQFQWFkxwwtCIa-4rd2o62NFHI.jpg","👃🏻"
"https://external-preview.redd.it/ZWkwZjRueW1xOWdmMV176jAzMlMviazdLIZaobVwtONxEl_pn5DUzs4SoQ7p.png?width=140&amp;height=94&amp;crop=140:94,smart&amp;format=jpg&amp;v=enabled&amp;lthumb=true&amp;s=2a13dccbc5549a98b000de732386601ec570e838","LC Sign guy does not flinch"
"https://b.thumbs.redditmedia.com/t2Jx8Tt0_UNsxU0AOe99lElPTN7966gaNNH0moRGlYw.jpg","Shrunken Head"
"https://external-preview.redd.it/bzBicDk3OW5mOWdmMUSI73Qdw7jd6UjeoITrlOLWVPlp8VVRsVTGVfzuf0wZ.png?width=140&amp;height=140&amp;crop=140:140,smart&amp;format=jpg&amp;v=enabled&amp;lthumb=true&amp;s=0706bb169fb723d26665d9bda4341f781be44321","Dogtor Checking Up on Her Mama"
"https://b.thumbs.redditmedia.com/Fhj7WLp7ulzPaSbxg2GKbVLokm7g1OjR9JtxCAlXU5c.jpg","Simple as that"
"https://a.thumbs.redditmedia.com/5fCXYC_a5AeAq8akYDysU2OvdiZd65fACYii5Ol4Vb8.jpg","Ai gotta know I'm a big boy now"
"https://external-preview.redd.it/dTBkN2k1YTkyYWdmMdhaa6WghSZQXFIJcAJN6VrRco0mCIWFX_hT6liUxe3y.png?width=140&amp;height=78&amp;crop=140:78,smart&amp;format=jpg&amp;v=enabled&amp;lthumb=true&amp;s=39a70b76dffe16ef238af5fbb453309c8052c299","Trump on Epstein stealing young women from Mar-a-Lago: ""I don’t know really why. I said if he’s taking anybody, hiring or whatever he’s doing, I didn’t like it."" Proceeds to blame ABC"
"https://b.thumbs.redditmedia.com/5cfOAF5B7Zd3XrXT0_hiZKT-aByeSdkOXCizDPTpPsM.jpg","David Rosen got THE photo of 2025"
"https://external-preview.redd.it/bDcza2Z0bGtlYWdmMa4xrrugTvP1a4tR10asBDB_F6n437FbL4Nf2Szyxd2P.png?width=140&amp;height=78&amp;crop=140:78,smart&amp;format=jpg&amp;v=enabled&amp;lthumb=true&amp;s=a2cd494c683bc901c84d5f3cea46ed2b5f6b6c9f","Toaster PC - Comment On This Post To Enter This Giveaway"
"https://b.thumbs.redditmedia.com/BwEpgpvfdTFWheMAXxptY7iGhzUY2R4rfxsMSawVezY.jpg","That’s one way to go about it."
"https://a.thumbs.redditmedia.com/FoXnuxozzdp5Oi45WIVjL2RYpwzJKAhL3Ow44Nwkls8.jpg","👹 MAGAs don't think things through."
"https://external-preview.redd.it/YmZwOTNxb3NvOWdmMWJ_dusRNXnmGYBA4gagFF-i8j5tE10RUJYhrzrtpFQC.png?width=140&amp;height=140&amp;crop=140:140,smart&amp;format=jpg&amp;v=enabled&amp;lthumb=true&amp;s=514c94c41b3fe36e08773ce375848ea29b5714bd","So it begins"
"https://external-preview.redd.it/dXFdUgfv4fTkk37hSL-qyh_Cq_6oDBmYzJguY6VXkpw.png?width=140&amp;height=140&amp;crop=140:140,smart&amp;auto=webp&amp;s=d20b99640827c2efcf555381d5b36e01b8c40786","Cryopreservation differences"
"https://a.thumbs.redditmedia.com/WC_hboI_eWz0o19wIAslpj_TlLqaaf_D_a8H95B8eA4.jpg","This"
"https://b.thumbs.redditmedia.com/ahZR8MKsIV8vBFg-b5k-pIm6UF8Qd_U3JTiJlxtx6qY.jpg","Am I overreacting? I think my SO has the worst style EVER!"
"https://b.thumbs.redditmedia.com/RSfP3W6wpg4jZZjZ8ppY6yPI6ifeXalloWsa4JQ9L8A.jpg","Child rapists? He hired one!"
"https://external-preview.redd.it/7dMkrVXe-kza5bO4PrQw12O_eolpri3AhH9iJYQ9jm4.jpeg?width=140&amp;height=70&amp;crop=140:70,smart&amp;auto=webp&amp;s=b0a2dcc561efb51ef109f59fca958901e43e6910","IRS declined to audit billionaire who admitted to funding Epstein’s island operation"
"https://b.thumbs.redditmedia.com/cvEHhUiangeydAGSw5eD49nAKpTd9xU0i4pw6j070XE.jpg","(Loved trope) The opening studio logos are changed for the movie"
"https://b.thumbs.redditmedia.com/D1wBMfrbYXH3IIPD-p8yZy8ySsuDG0Wtfyyr6Y9rF0c.jpg","So many tariff extensions it's crazy!"
"https://b.thumbs.redditmedia.com/gC6W7OnUNbIbqxVJoplD4f9UzXlqk_cuVXikyJ5iTrI.jpg","Just met them like 5mins ago, should i let them in or nah?"
"https://b.thumbs.redditmedia.com/K-LWp3P52A9MijYGhYF9WWbEz5HLhLVxwvxWa4h1kro.jpg","Absolutely happy for Dustin 🥲"
"https://b.thumbs.redditmedia.com/oOkJ9Xm3FBrmdYOQW-p9vT4YXxFOVtRzRn6LshxTJ4w.jpg","This is what my nephew does when he doesn’t want to listen."
"https://b.thumbs.redditmedia.com/HlC3KHOb-CtxCN65ytMF2hen87ym2XdK_o5fI0hboZo.jpg","Favorite characters like this"
"https://external-preview.redd.it/cXk0cXZxNjB4OGdmMTH1KkoZOLWDPKKGRrqvopL2NpOT0gh2h4prJX-5O_-i.png?width=140&amp;height=140&amp;crop=140:140,smart&amp;format=jpg&amp;v=enabled&amp;lthumb=true&amp;s=aafd15850cd15027418c59a7af860874139ad71f","Trump made 4,725 wire transfers to Epstein. Totaling nearly $1.1 Billion."
"https://external-preview.redd.it/tlH4fr9FnCYn1zwwbI3LeRfrkiKzbvdw0HblhwLI2PQ.jpeg?width=140&amp;height=93&amp;crop=140:93,smart&amp;auto=webp&amp;s=30fdfcb519f30de1f3651448ebc0de6d8adb09a4","Paramount+ loses 1.3 million subscribers"
"https://b.thumbs.redditmedia.com/_QWqRkACfp1rLs7Ngf960c5eXLxPcvkUnc-nDAncQio.jpg","I still think it would’ve been better if they hadn’t revealed who Doctor Doom is."
"https://a.thumbs.redditmedia.com/6jcPSM0EyUnnjfO_VkWMNLaEmOjhKEAGN85wk5I4xT0.jpg","📡📡📡"
"https://external-preview.redd.it/NXgybmd0bmZ6OWdmMdW0Xz7LvY5pF71ZyItIvvYx9lW124aivxKHPqd_zh7L.png?width=140&amp;height=140&amp;crop=140:140,smart&amp;format=jpg&amp;v=enabled&amp;lthumb=true&amp;s=dac2497ac0a0473e2d15be64b2ef997826ab88ac","The way the shade matches"
"https://b.thumbs.redditmedia.com/2w6DoDyE3VVTCn8IxX_SxZr1vr2_DJ9dkwkTOgTdD4o.jpg","Literal NPC behavior"
"https://b.thumbs.redditmedia.com/FUMpJLq_AnELXkY5uEbExn_wX3twuwI4QNSGrBX3ELc.jpg","Capitalism's Broken Promise"
"https://b.thumbs.redditmedia.com/g7zUH4yx0_4ZJe_xAlCXpkBgA42CTrCQEiZzBQlV_4Q.jpg","To collect life insurance"
"https://a.thumbs.redditmedia.com/yFZx-_-1ZraMNBaq_LklSDFnLkFtPiZ_bteuFVrbF48.jpg","Radioactive wasp nest found near site where US made nuclear bombs"
"https://b.thumbs.redditmedia.com/N_Kd8Wfh1BhM-4du7h4OLuBHfbgiR0J6k2o-MO6rZwg.jpg","I only bake for my kids’ birthdays—here’s my attempt at The Very Hungry Caterpillar for my daughter’s 4th!"
"https://b.thumbs.redditmedia.com/5nhOcV3wI7IREWlcV1kyuQxgihI6Uk9BiVAXGsIWUeQ.jpg","Good Guy Sen. Ron Wyden interrupts your regularly scheduled programming"
"https://external-preview.redd.it/dm9lajRhbjloOWdmMX5-C-NDf_UMkWts28n1n7na6qzj7DscHsiAoOGaAOzI.png?width=140&amp;height=140&amp;crop=140:140,smart&amp;format=jpg&amp;v=enabled&amp;lthumb=true&amp;s=318420d85ec292a393fc4d55d56440b43b22a90f","lol"
"https://external-preview.redd.it/bWRxaG8zMXRtOWdmMcCEjltoZtqzs7pYaKHE3v6grov6vFFxTjqYkcOSDO-a.png?width=140&amp;height=140&amp;crop=140:140,smart&amp;format=jpg&amp;v=enabled&amp;lthumb=true&amp;s=27ebc9adf7310f524d4270fb630a84900d345304","Average Dandadan Cosplays"
"https://b.thumbs.redditmedia.com/YBco9J7AW5TY7NJhpigxoRqq8yTbcV67LVvBw4LKAvs.jpg","The Minnesota Twins last 24 hours on Instagram"
"https://external-preview.redd.it/RVwIVmEg5EUA_AEyl1w2eBpAVxi_MN0oWZmzH4_Y7D8.jpeg?width=140&amp;height=140&amp;crop=140:140,smart&amp;auto=webp&amp;s=df126e89ccd18e4f5339b733c1faf53f55fc3662","Disgusting"
"https://external-preview.redd.it/NGVhN3U3M2Y1YmdmMTsvg5ynNRiU9DQ3cLA0xE0RCcCjaS4gQcITK513qH5d.png?width=140&amp;height=78&amp;crop=140:78,smart&amp;format=jpg&amp;v=enabled&amp;lthumb=true&amp;s=b8380b8ba7b5e6e412b144c3af5f1e72d0a1c6ec","We have our first NFL virtual measurement"
"https://external-preview.redd.it/cnkwNzNhcXJqOWdmMYtURdGMm1pNPJvqs-3CWvkkeR2SRGeNRqC3EaSQh-Jg.png?width=140&amp;height=140&amp;crop=140:140,smart&amp;format=jpg&amp;v=enabled&amp;lthumb=true&amp;s=579941073db9101ce84d08e465708fb8e4dfbf9c","Coldstream Guards played Paranoid at the Changing of the Guard RIP Ozzy Osbourne"
"https://b.thumbs.redditmedia.com/q8USTZwsXUcEc05FYbWAu_qlbjDX1cO62M5zyojTuBc.jpg","I know Ozzy ate a bat. Who is the other guy ?"
"https://b.thumbs.redditmedia.com/LZVKmqGmhHlsFptH4_lFKy6FCWeKmFu-8vSVmxCoizs.jpg","Sprites VS 3D models. What do you guys think?"
"https://b.thumbs.redditmedia.com/0esTFSd7p4z7mEZkJVmzPKJby5j3ACDxye3WRW-bePI.jpg","Yet another HR Linkedin Influencer"
"https://b.thumbs.redditmedia.com/-kotFbw80JTlZ-iJbGLstdpf1pRD9mArmDZsO4XbuGw.jpg","Facebook finds"
"https://external-preview.redd.it/NjBuMjhpOGo2Y2dmMSMycpHEyqWDF-ebX036JNaaHHs5CLA_j1F5i_IACnWR.png?width=140&amp;height=78&amp;crop=140:78,smart&amp;format=jpg&amp;v=enabled&amp;lthumb=true&amp;s=7a7e18c32b66a58bb79804c0865f0461588b7c56","LEAGUES CUP | Cruz Azul 0 - [7] Seattle Sounders | sweet baby jesus, lord have mercy..."
"https://external-preview.redd.it/YnQwMzZtbzZ5OGdmMcr9aVw9np_eOiVZDLYrEjb4KsBwlW_EMzGVb1CULC-z.png?width=140&amp;height=140&amp;crop=140:140,smart&amp;format=jpg&amp;v=enabled&amp;lthumb=true&amp;s=6295f8a0c8d5cbeb07b3c55f68cc52681bd1311b","Guy in Ireland stabs a police officer and gets a couple batons to the face"
"https://a.thumbs.redditmedia.com/_fDB7_ifcW-KYDYiohGSOAnd4hDcPTcTXhp9nZ5j_j8.jpg","But seriously why did we pardon them, let them vote, name monuments after them, and build statues for them?!"
"https://b.thumbs.redditmedia.com/MLpN_aYxw9_Oxy_DOV0c1mR6gXpnf5aCljMoSrjvHAo.jpg","How the fun gang are depicted in most fanart"
"https://b.thumbs.redditmedia.com/W9aJ0cfRYg13k7QbBhTdCykhhRhe3_zvrnPo7fVtIEg.jpg","In ancient Greece, prostitutes wore special sandals that printed a message in the ground reading, “follow me” to advertise their services"
"https://external-preview.redd.it/bjRibWNlN3JmYWdmMVU1zc3uZszOAWniIF_3nk8Y3SGuOVRWsWhl2VJrUGre.png?width=140&amp;height=78&amp;crop=140:78,smart&amp;format=jpg&amp;v=enabled&amp;lthumb=true&amp;s=9c5ae19ee62261e0bd7c7efdc4c4a5f86ec13f50","Iceberg collapses in Newfoundland"
"https://external-preview.redd.it/bTV1anJqemQ5OWdmMVACfZ7mDgjBe-pYWsY-_ILuBbmNK1_MYCEldPjwqsYK.png?width=140&amp;height=140&amp;crop=140:140,smart&amp;format=jpg&amp;v=enabled&amp;lthumb=true&amp;s=1f177fded1a46b69241891d1d976cbd79c2f825c","Opium being smuggled through a slingshot over the Afghanistan-Pakistan border"
"https://external-preview.redd.it/ZGg2ZzFwZWdkOWdmMRan96MsJhwjPeFo6VVSGQZXj-Ayh4meuQncOuQudbhr.png?width=140&amp;height=140&amp;crop=140:140,smart&amp;format=jpg&amp;v=enabled&amp;lthumb=true&amp;s=17197583b9f24131b1654ca6ee5b47f2e1fa301e","While I was hiking in Switzerland I found a birdbox in the middle of a forest containing Grappa and drinking glasses."
"https://external-preview.redd.it/2DcCeyeouUmW1jhPHzlfLnr3ZPS0clZLhqfTrNzE3O0.jpeg?width=140&amp;height=78&amp;crop=140:78,smart&amp;auto=webp&amp;s=bfed5b05b1e22ef8d29ce6672c36bfbc375cdf7e","TIL the ""Mona Lisa"" wasn't widely considered a masterpiece until after it was stolen by three handymen; the theft wasn't even noticed for over 24 hours"
"https://external-preview.redd.it/eHk2dzQ1cjE2OWdmMROuIgm9Yl5p3elTpjzroVJSMLF518810sayMsp--kIO.png?width=140&amp;height=128&amp;crop=140:128,smart&amp;format=jpg&amp;v=enabled&amp;lthumb=true&amp;s=0afd4de457559801a5e93993947d784cc4341ba0","Alright, Mom, I've showed my talent to the guests, now can i leave?"
"https://external-preview.redd.it/ZGhvb2RyMWtvN2dmMYmkBhLZtD7-TimEqIZGVoQQVAs4nHl9Eyo_uPm5ubY5.png?width=140&amp;height=140&amp;crop=140:140,smart&amp;format=jpg&amp;v=enabled&amp;lthumb=true&amp;s=c166496adea6f070f6ce721450928c4f68c6a733","At Oyoppi Cafe in Tokyo, the 'blooming apple tea' features thin apple slices that seemingly blossom as hot tea is poured over them."
"https://external-preview.redd.it/ZDRoZTh5aTEwOWdmMTFcgXytTzykIYBHErhm8AoJRa8Estqxz2m8q44y3U2j.png?width=140&amp;height=140&amp;crop=140:140,smart&amp;format=jpg&amp;v=enabled&amp;lthumb=true&amp;s=ccffb794b5d33856dffc97afbea2909a0d8896ec","Enjoy the Process of Crafting Glass Chandeliers"
"https://external-preview.redd.it/aXR5Y25uYW13OWdmMTejixucLCbO94SXlhw-wxKvcZMPwZZUojpxEDN0541f.png?width=140&amp;height=140&amp;crop=140:140,smart&amp;format=jpg&amp;v=enabled&amp;lthumb=true&amp;s=0082143098d363a91388dfd32a463507ea9c3bc8","This diver removes net caught around whales tail fin"
"https://external-preview.redd.it/NnRqaWtrZGU2YWdmMeQN7MD6hONOVEttsZPOZF0y8l9jcjz0IX-xixSjs-pL.png?width=140&amp;height=140&amp;crop=140:140,smart&amp;format=jpg&amp;v=enabled&amp;lthumb=true&amp;s=5825b0b4ef76dda44e75cf98fd1069b11558a74f","Grandpa showing he still got it"
"https://external-preview.redd.it/ZHBhbTd3dGgxYWdmMXldis6WSc4bMkTLlYfpHeMb9kKwIujXDKOrSwYe82Q-.png?width=140&amp;height=140&amp;crop=140:140,smart&amp;format=jpg&amp;v=enabled&amp;lthumb=true&amp;s=0564e6a11c9d04ae35b0218c392c89cbf862731c","This guy on a recorder is 🔥"
"https://b.thumbs.redditmedia.com/KZj244aLNP80isWKol4BhXYC7CVE-je89Q27rquMdDE.jpg","Gertrude Caroline Ederle, first woman to cross the english channel, 26 of August of 1926, done in 14hr and 31 min, beating the male record of 16hr and 33 min. Photos of the day she did it."
"https://b.thumbs.redditmedia.com/faMjdZVFDkbspwLPJhSpVJxwFEVfeRv1VqOBglU6Ujk.jpg","this mushroom growing kit I saw at the hardware store sprouted itself through the top"
"https://external-preview.redd.it/LxHo-FTrq3Xx_COmZRmJobDcZK0zLztjoxTxeSYFdNI.png?width=140&amp;height=129&amp;crop=140:129,smart&amp;auto=webp&amp;s=b87d805508c982dc23b70a61a99364ea9889ab34","TIL of Malört, a liqueur almost exclusive to Chicago, described as ""like swallowing a burnt condom filled with gasoline."" Drinking a shot is considered a Windy City rite of passage."
"https://external-preview.redd.it/dG0zcm4xcnhtOWdmMUa9M173leKlO5i3jIYoy_W4xjp3MEcM_OTSRxTLrZEX.png?width=140&amp;height=140&amp;crop=140:140,smart&amp;format=jpg&amp;v=enabled&amp;lthumb=true&amp;s=98500707cff913f9c5f1f14ff85c0eb0d7e1d552","Guards play “Paranoid” in honor of Ozzy Osborne"
"https://external-preview.redd.it/ZWg2MWZlcHo4Y2dmMZkL-YYGpRVqgQFSXaGWulewghVzxtheVOYA9q_cX9py.png?width=140&amp;height=140&amp;crop=140:140,smart&amp;format=jpg&amp;v=enabled&amp;lthumb=true&amp;s=64cd202b6ae936b8d4b3034516a0508ba4d9ef8d","Great art on the soccer field"
"https://external-preview.redd.it/dmx0endtcmR0N2dmMdjaLDEuGvKRZaZo-A32m1IYD9XRTOBjp8gWK7d6N_oY.png?width=140&amp;height=140&amp;crop=140:140,smart&amp;format=jpg&amp;v=enabled&amp;lthumb=true&amp;s=83a0c3e9607db5724108ca1b55bc49c1d8e58f24","Falling tree almost hits cyclist during severe weather"
"https://b.thumbs.redditmedia.com/gAFQ0IMVse2H7JKNDOL352OHjEGaDMcnq9CSnObsWYA.jpg","A baby born from an embryo frozen in 1994 has broken the record for the world's ""oldest baby"". Source in the comment."
"https://external-preview.redd.it/dDJpdmFodGFoOGdmMdOe3DLundAbqKht17WTxXvOwYB6jU0Jbnqihh3P2qdj.png?width=140&amp;height=140&amp;crop=140:140,smart&amp;format=jpg&amp;v=enabled&amp;lthumb=true&amp;s=c7d73d76c6f903cc0d4b85956a7d43d044dd1191","Using CRISPR technique, scientists can genetically modify mosquitoes by disabling a specific gene in females rendering them unable to pierce human skin."
"https://b.thumbs.redditmedia.com/0wlkmeGgXNw9Zo7ypsvAV2UILz_qvRUOcn76CZ5FCDs.jpg","The boardwalk wood isn’t getting wet around the screws"
"https://b.thumbs.redditmedia.com/t8FXEVx-B1avDawGu_oP91xHOGCTS3TUm1GJjnuGJvA.jpg","This 80-year-old retiree noticed that people were abandoning their dogs near his farm, so he took them in and built a train to take them out for rides"
"https://b.thumbs.redditmedia.com/MhNFQSz5rCjYG3HV8DfZN84CBr-GDuQn34bSODwLgKo.jpg","A photo of the Moses Bridge in the Netherlands."
"https://external-preview.redd.it/aDB1N3o0bW1yYWdmMUsMte7QPut35lTEqfNBs9fQGRbO1RDG1kfrRvEjUHk-.png?width=140&amp;height=140&amp;crop=140:140,smart&amp;format=jpg&amp;v=enabled&amp;lthumb=true&amp;s=2e4e3e719002e6ea79579e6a8cc409ade7fb3e22","Bro invented a new skateboard trick"
"https://b.thumbs.redditmedia.com/9RS2Evi4lpmkslPNlJiLo6KO3FHL-KI4l_EJ9Nwrz_c.jpg","China cut a mountain in half to build a highway. Guizhou Province"
"https://a.thumbs.redditmedia.com/bs16784Tq8a4zzfxURADsxb6BaF3Dl6FtnA9jRCnT_0.jpg","Almost flat rainbow"
"https://external-preview.redd.it/MjgyOThweGcyOWdmMdfsYAm_GNLzI8WqTnsCBrMjluWP4uVnbW5YQtVEqyN1.png?width=140&amp;height=140&amp;crop=140:140,smart&amp;format=jpg&amp;v=enabled&amp;lthumb=true&amp;s=1a31c1ed1aa484d94ad83edf44fef254f4f9c1dc","Man with no hands doing his job exceptionally."
"https://a.thumbs.redditmedia.com/_3fz-zGaxVZSb1itzdFs8UwvsQr6c3-NxssqSP8Nhz8.jpg","3 galaxies photographed at once from the ISS"
"https://b.thumbs.redditmedia.com/-kYHrI3jtPcubv7zVg4358s-A-aIAQJV2T71qy2-4xI.jpg","When the Icebergs Came to Town - Inaarsuit, Greenland"
"https://external-preview.redd.it/ZTZiZmViaXQ1N2dmMWQpPT5B-hfWD_rWoALmgqYvhgfqeWXxDhoofHvwKROK.png?width=140&amp;height=140&amp;crop=140:140,smart&amp;format=jpg&amp;v=enabled&amp;lthumb=true&amp;s=deeed232551705d78c536802d08fd892aafb08b3","An eagle casually flying off with a goat..!"
"https://b.thumbs.redditmedia.com/J1-QNYH9pQD181I75ARsZF-sbwWE86uivJhCd7WLjRM.jpg","There are four seats, but the shadow only casts three due to the lighting."
"https://b.thumbs.redditmedia.com/PE0exGXMFfH8CQREpxRkiAmkF_u4QFS6AxzDoUsSoew.jpg","Autochrome from the US in the 1910 to 1920s. Not modern colorized, this is natural color of the process at the time, before kodachromes."
"https://external-preview.redd.it/NGczNG1lYjBvOGdmMZ4kcmelb5R1_oEKy9W8G6D34xQEmVN-ffOc7GP4uqzl.png?width=140&amp;height=140&amp;crop=140:140,smart&amp;format=jpg&amp;v=enabled&amp;lthumb=true&amp;s=e0bd4343e5674171fc9955e59fbb9cd5143cc749","Once in a lifetime shot! Tried to play it off like he didn’t just get a fire take"
"https://external-preview.redd.it/Z292YTZhZ3J1N2dmMRY9ybT09KHQ_gThV64mC1rM_xl88tJrJIsVVCr0n47-.png?width=140&amp;height=140&amp;crop=140:140,smart&amp;format=jpg&amp;v=enabled&amp;lthumb=true&amp;s=3f86497e8ece5e6919006943d0ec0f2f20569fc0","Courage Adams World Record Nose Manual On A Treadmill"
"https://external-preview.redd.it/cjJrM29tZnZrYmdmMebwu3b68cCCZYF33rIeqKFIfha65zpGXUz3VMofNT70.png?width=140&amp;height=140&amp;crop=140:140,smart&amp;format=jpg&amp;v=enabled&amp;lthumb=true&amp;s=b9f77565774747afa0bd9a23f505916489ed02a9","Insanely satisfying juggling by Takehiro Nagaoka"
"https://external-preview.redd.it/exgVuM3XRvTN0nQ_znqGg9sgQDx8ZpUOd5ugFP31Bcg.jpeg?width=140&amp;height=78&amp;crop=140:78,smart&amp;auto=webp&amp;s=f23039f2643c5456dc4fbc4c567a503533c92ee9","TIL the iPad was in development long before the iPhone, despite officially releasing 3 years after the iPhone."
"https://b.thumbs.redditmedia.com/yYVTljJbazqoKhMDUguSDrWQZN1-zF5W0St36HgjeTA.jpg","Replica of 16th Century suit of armour created by Chris Gilman of Global Effects Inc, worn here by Adam Savage of Mythbusters fame. This intricate project took 20 years to complete"
"https://external-preview.redd.it/b-Ehy5AhkSRE_OMPXqSIwu9T_axqvhZv9OGQAcNiKcU.jpeg?width=140&amp;height=140&amp;crop=140:140,smart&amp;auto=webp&amp;s=d1e4c1e4359ab401f9a62a77ddac9decf9869265","TIL some native Japanese have facial features linked to Jomon ancestry that are visually similar to those of Caucasians"
"https://a.thumbs.redditmedia.com/XhaU5cd2qvmMjQ50BoxpRS7lblJbP73Ndpd5oYWdfr0.jpg","I cracked this egg and it was full of blood"
