image_url,title
"https://via.placeholder.com/500x300/0066cc/ffffff?text=If%20you%20had%20to%20pin%20all%20your%20life%20problems%20on%20one%20da","If you had to pin all your life problems on one day, what happened that day?"
"https://via.placeholder.com/500x300/0066cc/ffffff?text=if%20walking%20was%20the%20only%20transportation%20what%20would%20","if walking was the only transportation what would you do?"
"https://via.placeholder.com/500x300/0066cc/ffffff?text=Remember%20the%20%E2%80%9Cbad%20kid%E2%80%9D%20from%20your%20childhood%20-%20where","Remember the “bad kid” from your childhood - where are they now?"
"https://via.placeholder.com/500x300/0066cc/ffffff?text=What%20phrase%20did%20a%20fictional%20character%20say%20that%20stu","What phrase did a fictional character say that stuck in your mind?"
"https://via.placeholder.com/500x300/0066cc/ffffff?text=What%20is%20the%20craziest%20thing%20you%20ever%20witnessed%20in%20c","What is the craziest thing you ever witnessed in church?"
"https://via.placeholder.com/500x300/0066cc/ffffff?text=What%E2%80%99s%20a%20compliment%20that%20has%20stuck%20with%20you%20and%20ca","What’s a compliment that has stuck with you and can instantly cheer you up when you think about it?"
"https://via.placeholder.com/500x300/0066cc/ffffff?text=What%20TV%20show%20are%20you%20embarrassed%20to%20admit%20being%20a%20","What TV show are you embarrassed to admit being a fan of?"
"https://via.placeholder.com/500x300/0066cc/ffffff?text=What%20was%20the%20best%20thing%20that%20you%20ever%20heard%20someon","What was the best thing that you ever heard someone say before they took a dirt nap. what did they say ?"
"https://via.placeholder.com/500x300/0066cc/ffffff?text=How%20do%20you%20become%20a%20positive%20person%3F","How do you become a positive person?"
"https://via.placeholder.com/500x300/0066cc/ffffff?text=What%20song%20is%20stuck%20in%20your%20head%20right%20now%3F","What song is stuck in your head right now?"
"https://via.placeholder.com/500x300/0066cc/ffffff?text=You%E2%80%99re%20arrested%20but%20innocent.%20What%E2%80%99s%20the%20weirdest%20","You’re arrested but innocent. What’s the weirdest thing the cops could find in your room that would make you look guilty?"
"https://via.placeholder.com/500x300/0066cc/ffffff?text=What%20are%20you%20addicted%20to%3F","What are you addicted to?"
"https://via.placeholder.com/500x300/0066cc/ffffff?text=What%E2%80%99s%20a%20truth%20about%20people%20that%20you%20realized%20too%20","What’s a truth about people that you realized too late in life?"
"https://via.placeholder.com/500x300/0066cc/ffffff?text=For%20shits%20and%20giggles%20only%2C%20what%E2%80%99s%20something%20funny","For shits and giggles only, what’s something funny that you experienced recently?"
"https://via.placeholder.com/500x300/0066cc/ffffff?text=What%20normal%20parenting%20methods%20in%20the%2090s%20that%20woul","What normal parenting methods in the 90s that would be considered unsafe today?"
"https://via.placeholder.com/500x300/0066cc/ffffff?text=Every%20satellite%20orbiting%20earth%20and%20who%20owns%20them%20(","Every satellite orbiting earth and who owns them (2023)"
"https://via.placeholder.com/500x300/0066cc/ffffff?text=Slow","Slow"
"https://via.placeholder.com/500x300/0066cc/ffffff?text=Mountain%20of%20Ink","Mountain of Ink"
"https://via.placeholder.com/500x300/0066cc/ffffff?text=Releasing%20weights%20for%20FLUX.1%20Krea","Releasing weights for FLUX.1 Krea"
"https://via.placeholder.com/500x300/0066cc/ffffff?text=The%20anti-abundance%20critique%20on%20housing%20is%20wrong","The anti-abundance critique on housing is wrong"
"https://via.placeholder.com/500x300/0066cc/ffffff?text=QUIC%20for%20the%20kernel","QUIC for the kernel"
"https://via.placeholder.com/500x300/0066cc/ffffff?text=Ubiquiti%20launches%20UniFi%20OS%20Server%20for%20self-hosting","Ubiquiti launches UniFi OS Server for self-hosting"
"https://via.placeholder.com/500x300/0066cc/ffffff?text=MacBook%20Pro%20Insomnia","MacBook Pro Insomnia"
"https://via.placeholder.com/500x300/0066cc/ffffff?text=Show%20HN%3A%20KubeForge%20%E2%80%93%20A%20GUI%20for%20Kubernetes%20YAMLs","Show HN: KubeForge – A GUI for Kubernetes YAMLs"
"https://via.placeholder.com/500x300/0066cc/ffffff?text=Gemini%20Embedding%3A%20Powering%20RAG%20and%20context%20enginee","Gemini Embedding: Powering RAG and context engineering"
"https://via.placeholder.com/500x300/0066cc/ffffff?text=Show%20HN%3A%20I%20made%20a%20website%20that%20makes%20you%20cry","Show HN: I made a website that makes you cry"
"https://via.placeholder.com/500x300/0066cc/ffffff?text=Replacing%20cron%20jobs%20with%20a%20centralized%20task%20schedu","Replacing cron jobs with a centralized task scheduler"
"https://via.placeholder.com/500x300/0066cc/ffffff?text=Show%20HN%3A%20Mcp-use%20%E2%80%93%20Connect%20any%20LLM%20to%20any%20MCP","Show HN: Mcp-use – Connect any LLM to any MCP"
"https://via.placeholder.com/500x300/0066cc/ffffff?text=Many%20countries%20that%20said%20no%20to%20ChatControl%20in%202024","Many countries that said no to ChatControl in 2024 are now undecided"
"https://via.placeholder.com/500x300/0066cc/ffffff?text=%E2%80%9CNo%20tax%20on%20tips%E2%80%9D%20is%20an%20industry%20plant","“No tax on tips” is an industry plant"
"https://via.placeholder.com/500x300/0066cc/ffffff?text=LLM%20leaderboard%20%E2%80%93%20Comparing%20models%20from%20OpenAI%2C%20Go","LLM leaderboard – Comparing models from OpenAI, Google, DeepSeek and others"
"https://via.placeholder.com/500x300/0066cc/ffffff?text=Telephone%20colophon%3A%20Or%2C%20how%20I%20overengineered%20my%20ca","Telephone colophon: Or, how I overengineered my call audio (2020)"
"https://via.placeholder.com/500x300/0066cc/ffffff?text=Programmers%20aren%E2%80%99t%20so%20humble%20anymore%2C%20maybe%20becaus","Programmers aren’t so humble anymore, maybe because nobody codes in Perl"
"https://via.placeholder.com/500x300/0066cc/ffffff?text=Scientists%20and%20engineers%20craft%20radio%20telescope%20bou","Scientists and engineers craft radio telescope bound for the moon"
"https://via.placeholder.com/500x300/0066cc/ffffff?text=Show%20HN%3A%20AgentMail%20%E2%80%93%20Email%20infra%20for%20AI%20agents","Show HN: AgentMail – Email infra for AI agents"
"https://via.placeholder.com/500x300/0066cc/ffffff?text=Secure%20boot%20certificate%20rollover%20is%20real%20but%20proba","Secure boot certificate rollover is real but probably won't hurt you"
"https://via.placeholder.com/500x300/0066cc/ffffff?text=Raspberry%20Pi%205%20Gets%20a%20MicroSD%20Express%20Hat","Raspberry Pi 5 Gets a MicroSD Express Hat"
"https://via.placeholder.com/500x300/0066cc/ffffff?text=Face%20it%3A%20you're%20a%20crazy%20person","Face it: you're a crazy person"
"https://via.placeholder.com/500x300/0066cc/ffffff?text=Age%20verification%20doesn't%20need%20to%20be%20a%20privacy%20foot","Age verification doesn't need to be a privacy footgun"
"https://via.placeholder.com/500x300/0066cc/ffffff?text=Carbon%20Language%3A%20An%20experimental%20successor%20to%20C%2B%2B","Carbon Language: An experimental successor to C++"
"https://via.placeholder.com/500x300/0066cc/ffffff?text=AI%20is%20a%20floor%20raiser%2C%20not%20a%20ceiling%20raiser","AI is a floor raiser, not a ceiling raiser"
"https://via.placeholder.com/500x300/0066cc/ffffff?text=Denver%20rent%20is%20back%20to%202022%20prices%20after%2020k%20new%20u","Denver rent is back to 2022 prices after 20k new units hit the market"
"https://via.placeholder.com/500x300/0066cc/ffffff?text=Windows%20Directory%20Structure%20Synchronizer","Windows Directory Structure Synchronizer"
"https://via.placeholder.com/500x300/0066cc/ffffff?text=150%20years%20of%20Hans%20Christian%20Andersen","150 years of Hans Christian Andersen"
"https://via.placeholder.com/500x300/0066cc/ffffff?text=How%20was%20the%20Universal%20Pictures%201936%20opening%20logo%20c","How was the Universal Pictures 1936 opening logo created?"
"https://via.placeholder.com/500x300/0066cc/ffffff?text=voyage-context-3%3A%20Contextual%20Retrieval%20Without%20the","voyage-context-3: Contextual Retrieval Without the LLM"
"https://via.placeholder.com/500x300/0066cc/ffffff?text=Zig%20Profiling%20on%20Apple%20Silicon","Zig Profiling on Apple Silicon"
"https://via.placeholder.com/500x300/0066cc/ffffff?text=Kaizen%20(YC%20X25)%20is%20hiring%20engineers%20to%20build%20brows","Kaizen (YC X25) is hiring engineers to build browser agents that work"
"https://via.placeholder.com/500x300/0066cc/ffffff?text=The%20Math%20Is%20Haunted","The Math Is Haunted"
"https://via.placeholder.com/500x300/0066cc/ffffff?text=We%20revamped%20our%20docs%20for%20AI-driven%20development","We revamped our docs for AI-driven development"
"https://via.placeholder.com/500x300/0066cc/ffffff?text=Show%20HN%3A%20Sourcebot%20%E2%80%93%C2%A0Self-hosted%20Perplexity%20for%20yo","Show HN: Sourcebot – Self-hosted Perplexity for your codebase"
"https://via.placeholder.com/500x300/0066cc/ffffff?text=What%20is%20gVisor%3F","What is gVisor?"
"https://via.placeholder.com/500x300/0066cc/ffffff?text=Dark%20patterns","Dark patterns"
"https://via.placeholder.com/500x300/0066cc/ffffff?text=OpenAI's%20ChatGPT%20Agent%20casually%20clicks%20through%20%22I%20","OpenAI's ChatGPT Agent casually clicks through ""I am not a robot"" verification"
"https://via.placeholder.com/500x300/0066cc/ffffff?text=Ferrari%20Status","Ferrari Status"
"https://via.placeholder.com/500x300/0066cc/ffffff?text=A%20memory%20safe%20C%20framework%2C%20RAII%2C%20I%2FO%2C%20coroutine%20an","A memory safe C framework, RAII, I/O, coroutine and other concurrency primitives"
"https://via.placeholder.com/500x300/0066cc/ffffff?text=Show%20HN%3A%20Walk-through%20of%20rocket%20landing%20optimizati","Show HN: Walk-through of rocket landing optimization paper [pdf]"
"https://via.placeholder.com/500x300/0066cc/ffffff?text=Following%20Up%20on%20the%20Python%20JIT","Following Up on the Python JIT"
"https://via.placeholder.com/500x300/0066cc/ffffff?text=So%20you're%20a%20manager%20now","So you're a manager now"
"https://via.placeholder.com/500x300/0066cc/ffffff?text=Astronomical%20Telescope%20%E2%80%9CHadley%E2%80%9D%20%E2%80%93%20an%20easy%20assembly","Astronomical Telescope “Hadley” – an easy assembly, high performance Newtonian"
"https://via.placeholder.com/500x300/0066cc/ffffff?text=Crafting%20your%20own%20Static%20Site%20Generator%20using%20Phoe","Crafting your own Static Site Generator using Phoenix (2023)"
"https://via.placeholder.com/500x300/0066cc/ffffff?text=Fast","Fast"
"https://via.placeholder.com/500x300/0066cc/ffffff?text=Sumo%20%E2%80%93%20Simulation%20of%20Urban%20Mobility","Sumo – Simulation of Urban Mobility"
"https://via.placeholder.com/500x300/0066cc/ffffff?text=Introduction%20to%20Computer%20Music","Introduction to Computer Music"
"https://via.placeholder.com/500x300/0066cc/ffffff?text=sunt%20aut%20facere%20repellat%20provident%20occaecati%20excep","Sunt aut facere repellat provident occaecati excepturi optio reprehenderit"
"https://via.placeholder.com/500x300/0066cc/ffffff?text=qui%20est%20esse","Qui est esse"
"https://via.placeholder.com/500x300/0066cc/ffffff?text=ea%20molestias%20quasi%20exercitationem%20repellat%20qui%20ips","Ea molestias quasi exercitationem repellat qui ipsa sit aut"
"https://via.placeholder.com/500x300/0066cc/ffffff?text=eum%20et%20est%20occaecati","Eum et est occaecati"
"https://via.placeholder.com/500x300/0066cc/ffffff?text=nesciunt%20quas%20odio","Nesciunt quas odio"
"https://via.placeholder.com/500x300/0066cc/ffffff?text=dolorem%20eum%20magni%20eos%20aperiam%20quia","Dolorem eum magni eos aperiam quia"
"https://via.placeholder.com/500x300/0066cc/ffffff?text=magnam%20facilis%20autem","Magnam facilis autem"
"https://via.placeholder.com/500x300/0066cc/ffffff?text=dolorem%20dolore%20est%20ipsam","Dolorem dolore est ipsam"
"https://via.placeholder.com/500x300/0066cc/ffffff?text=nesciunt%20iure%20omnis%20dolorem%20tempora%20et%20accusantium","Nesciunt iure omnis dolorem tempora et accusantium"
"https://via.placeholder.com/500x300/0066cc/ffffff?text=optio%20molestias%20id%20quia%20eum","Optio molestias id quia eum"
"https://via.placeholder.com/500x300/0066cc/ffffff?text=et%20ea%20vero%20quia%20laudantium%20autem","Et ea vero quia laudantium autem"
"https://via.placeholder.com/500x300/0066cc/ffffff?text=in%20quibusdam%20tempore%20odit%20est%20dolorem","In quibusdam tempore odit est dolorem"
"https://via.placeholder.com/500x300/0066cc/ffffff?text=dolorum%20ut%20in%20voluptas%20mollitia%20et%20saepe%20quo%20animi","Dolorum ut in voluptas mollitia et saepe quo animi"
"https://via.placeholder.com/500x300/0066cc/ffffff?text=voluptatem%20eligendi%20optio","Voluptatem eligendi optio"
"https://via.placeholder.com/500x300/0066cc/ffffff?text=eveniet%20quod%20temporibus","Eveniet quod temporibus"
"https://via.placeholder.com/500x300/0066cc/ffffff?text=sint%20suscipit%20perspiciatis%20velit%20dolorum%20rerum%20ips","Sint suscipit perspiciatis velit dolorum rerum ipsa laboriosam odio"
"https://via.placeholder.com/500x300/0066cc/ffffff?text=fugit%20voluptas%20sed%20molestias%20voluptatem%20provident","Fugit voluptas sed molestias voluptatem provident"
"https://via.placeholder.com/500x300/0066cc/ffffff?text=voluptate%20et%20itaque%20vero%20tempora%20molestiae","Voluptate et itaque vero tempora molestiae"
"https://via.placeholder.com/500x300/0066cc/ffffff?text=adipisci%20placeat%20illum%20aut%20reiciendis%20qui","Adipisci placeat illum aut reiciendis qui"
"https://via.placeholder.com/500x300/0066cc/ffffff?text=doloribus%20ad%20provident%20suscipit%20at","Doloribus ad provident suscipit at"
"https://via.placeholder.com/500x300/0066cc/ffffff?text=asperiores%20ea%20ipsam%20voluptatibus%20modi%20minima%20quia%20","Asperiores ea ipsam voluptatibus modi minima quia sint"
"https://via.placeholder.com/500x300/0066cc/ffffff?text=dolor%20sint%20quo%20a%20velit%20explicabo%20quia%20nam","Dolor sint quo a velit explicabo quia nam"
"https://via.placeholder.com/500x300/0066cc/ffffff?text=maxime%20id%20vitae%20nihil%20numquam","Maxime id vitae nihil numquam"
"https://via.placeholder.com/500x300/0066cc/ffffff?text=autem%20hic%20labore%20sunt%20dolores%20incidunt","Autem hic labore sunt dolores incidunt"
"https://via.placeholder.com/500x300/0066cc/ffffff?text=rem%20alias%20distinctio%20quo%20quis","Rem alias distinctio quo quis"
"https://via.placeholder.com/500x300/0066cc/ffffff?text=est%20et%20quae%20odit%20qui%20non","Est et quae odit qui non"
"https://via.placeholder.com/500x300/0066cc/ffffff?text=quasi%20id%20et%20eos%20tenetur%20aut%20quo%20autem","Quasi id et eos tenetur aut quo autem"
"https://via.placeholder.com/500x300/0066cc/ffffff?text=delectus%20ullam%20et%20corporis%20nulla%20voluptas%20sequi","Delectus ullam et corporis nulla voluptas sequi"
"https://via.placeholder.com/500x300/0066cc/ffffff?text=iusto%20eius%20quod%20necessitatibus%20culpa%20ea","Iusto eius quod necessitatibus culpa ea"
"https://via.placeholder.com/500x300/0066cc/ffffff?text=a%20quo%20magni%20similique%20perferendis","A quo magni similique perferendis"
"https://via.placeholder.com/500x300/0066cc/ffffff?text=ullam%20ut%20quidem%20id%20aut%20vel%20consequuntur","Ullam ut quidem id aut vel consequuntur"
"https://via.placeholder.com/500x300/0066cc/ffffff?text=doloremque%20illum%20aliquid%20sunt","Doloremque illum aliquid sunt"
"https://via.placeholder.com/500x300/0066cc/ffffff?text=qui%20explicabo%20molestiae%20dolorem","Qui explicabo molestiae dolorem"
"https://via.placeholder.com/500x300/0066cc/ffffff?text=magnam%20ut%20rerum%20iure","Magnam ut rerum iure"
"https://via.placeholder.com/500x300/0066cc/ffffff?text=id%20nihil%20consequatur%20molestias%20animi%20provident","Id nihil consequatur molestias animi provident"
"https://via.placeholder.com/500x300/0066cc/ffffff?text=fuga%20nam%20accusamus%20voluptas%20reiciendis%20itaque","Fuga nam accusamus voluptas reiciendis itaque"
"https://via.placeholder.com/500x300/0066cc/ffffff?text=provident%20vel%20ut%20sit%20ratione%20est","Provident vel ut sit ratione est"
"https://via.placeholder.com/500x300/0066cc/ffffff?text=explicabo%20et%20eos%20deleniti%20nostrum%20ab%20id%20repellendu","Explicabo et eos deleniti nostrum ab id repellendus"
"https://via.placeholder.com/500x300/0066cc/ffffff?text=eos%20dolorem%20iste%20accusantium%20est%20eaque%20quam","Eos dolorem iste accusantium est eaque quam"
"https://via.placeholder.com/500x300/0066cc/ffffff?text=enim%20quo%20cumque","Enim quo cumque"
"https://via.placeholder.com/500x300/0066cc/ffffff?text=non%20est%20facere","Non est facere"
"https://via.placeholder.com/500x300/0066cc/ffffff?text=commodi%20ullam%20sint%20et%20excepturi%20error%20explicabo%20pr","Commodi ullam sint et excepturi error explicabo praesentium voluptas"
"https://via.placeholder.com/500x300/0066cc/ffffff?text=eligendi%20iste%20nostrum%20consequuntur%20adipisci%20praese","Eligendi iste nostrum consequuntur adipisci praesentium sit beatae perferendis"
"https://via.placeholder.com/500x300/0066cc/ffffff?text=optio%20dolor%20molestias%20sit","Optio dolor molestias sit"
"https://via.placeholder.com/500x300/0066cc/ffffff?text=ut%20numquam%20possimus%20omnis%20eius%20suscipit%20laudantium","Ut numquam possimus omnis eius suscipit laudantium iure"
"https://via.placeholder.com/500x300/0066cc/ffffff?text=aut%20quo%20modi%20neque%20nostrum%20ducimus","Aut quo modi neque nostrum ducimus"
"https://via.placeholder.com/500x300/0066cc/ffffff?text=quibusdam%20cumque%20rem%20aut%20deserunt","Quibusdam cumque rem aut deserunt"
"https://via.placeholder.com/500x300/0066cc/ffffff?text=ut%20voluptatem%20illum%20ea%20doloribus%20itaque%20eos","Ut voluptatem illum ea doloribus itaque eos"
"https://via.placeholder.com/500x300/0066cc/ffffff?text=laborum%20non%20sunt%20aut%20ut%20assumenda%20perspiciatis%20vol","Laborum non sunt aut ut assumenda perspiciatis voluptas"
"https://via.placeholder.com/500x300/0066cc/ffffff?text=repellendus%20qui%20recusandae%20incidunt%20voluptates%20ten","Repellendus qui recusandae incidunt voluptates tenetur qui omnis exercitationem"
"https://b.thumbs.redditmedia.com/PE2dEnwjDuLurJKXXBes4BF71HuZryGR2n46vLpJNFg.jpg","[Photos]: My mom grew braided carrots"
"https://b.thumbs.redditmedia.com/PE2dEnwjDuLurJKXXBes4BF71HuZryGR2n46vLpJNFg.jpg","My mom grew braided carrots That Broke The Internet"
"https://b.thumbs.redditmedia.com/PE2dEnwjDuLurJKXXBes4BF71HuZryGR2n46vLpJNFg.jpg","5 Reasons Why My mom grew braided carrots"
"https://external-preview.redd.it/uybAAuxkNEnwynfdsyyaY7pYJOTk_IxS7qH92W28QXY.jpeg?width=140&amp;height=70&amp;crop=140:70,smart&amp;auto=webp&amp;s=f3ab43a28576419cd3ff8c24cab186f6432a5718","This Will Shock You: Ex-CIA Whistleblower: ""The NSA Audited The 2024 Election, Kamala Harris Won"""
"https://external-preview.redd.it/g3p_uMWiiaBLP9TjPh65SaorEq6HTgqkyVvkbczIIFk.jpeg?width=140&amp;height=93&amp;crop=140:93,smart&amp;auto=webp&amp;s=70bb749177a902886050ee57633e39784368ed05","10 Things About Smithsonian removes Trump from impeachment exhibit in American History Museum That Will Surprise You"
"https://b.thumbs.redditmedia.com/jyXwa88O1TkzFVTfJMK8s6lIZT-Faa-KmZEM4Lhx3Ig.jpg","Shocking Discovery: Gay Sex Prevents Abortion - Columbus, OH"
"https://external-preview.redd.it/g3p_uMWiiaBLP9TjPh65SaorEq6HTgqkyVvkbczIIFk.jpeg?width=140&amp;height=93&amp;crop=140:93,smart&amp;auto=webp&amp;s=70bb749177a902886050ee57633e39784368ed05","Smithsonian removes Trump from impeachment exhibit in American History Museum That Will Change Your Life"
"https://a.thumbs.redditmedia.com/5j1rE4S5x1QXgbsoUKKzRi1mAz9GtD77hmB5bHY71X0.jpg","Meirl You Never Knew Existed"
"https://b.thumbs.redditmedia.com/UQQKa4fov6iETR0tEoYcORNmC-CcyQlF9Zn3gf2U-Mg.jpg","Doctors Hate This: Trump named in multiple documents related to Epstein sex trafficking, WSJ reports"
"https://b.thumbs.redditmedia.com/UQQKa4fov6iETR0tEoYcORNmC-CcyQlF9Zn3gf2U-Mg.jpg","10 Facts About Trump named in multiple documents related to Epstein sex trafficking, WSJ reports You Never Knew"
"https://b.thumbs.redditmedia.com/dGErlHA4iNCt6f08eHKtPU9oKAEA9fYjo9ySks1bhGs.jpg","Incredible Story Of: Las Vegas voted for an Economic change and are mad that the economy changed. At least they won’t pay taxes on the 50% less tips they are receiving."
"https://b.thumbs.redditmedia.com/dGErlHA4iNCt6f08eHKtPU9oKAEA9fYjo9ySks1bhGs.jpg","Las Vegas voted for an Economic change and are mad that the economy changed. At least they won’t pay taxes on the 50% less tips they are receiving. Everyone Is Obsessed With"
"https://b.thumbs.redditmedia.com/wNOQLeJnlhLK2ImkwM9FUgrSA11rsN7tq4IYTFARzpQ.jpg","What Happened Next Will Amaze You: Ms Rachel for The Washington Post, photographed by Natalie Keyssar."
"https://b.thumbs.redditmedia.com/wNOQLeJnlhLK2ImkwM9FUgrSA11rsN7tq4IYTFARzpQ.jpg","Ms Rachel for The Washington Post, photographed by Natalie Keyssar. You Wish You Knew Sooner"
"https://external-preview.redd.it/N29udnpjb3pzYmdmMeso-R1XNE2qBBtjnShlrNKB89JLYsyDWkYl2Rdx0Tcm.png?width=140&amp;height=140&amp;crop=140:140,smart&amp;format=jpg&amp;v=enabled&amp;lthumb=true&amp;s=264f37bdd24d64c3bb776d376723f7eb22897f4b","[Pics]: Scientists have discovered a giant new species of stick insect in Australia, which is over 15 inches long and researchers say may be the heaviest insect in the country."
"https://b.thumbs.redditmedia.com/tgOEcFi6v7SBIjzlwMKPW9ugklamD0Y5RMZ4a7-BFoI.jpg","The Truth About: It sure is :)"
"https://a.thumbs.redditmedia.com/TfZB8eCd_8VKAFqSmnLf6CP-NijZr5jeqzth_zmsof0.jpg","You Won't Believe: Chamber of Secrets for Dumbledore’s Army?"
"https://b.thumbs.redditmedia.com/NId6icvhItAejY1LttjddoYw1eW_VcIBmgfmf4LC73s.jpg","Incredible Story Of: Yes. We know America really didn't vote for a pedophile. Did they?"
"https://b.thumbs.redditmedia.com/NId6icvhItAejY1LttjddoYw1eW_VcIBmgfmf4LC73s.jpg","15 Facts About Yes. We know America really didn't vote for a pedophile. Did they? You Never Knew"
"https://b.thumbs.redditmedia.com/n2BgekEr4hQhhYlNQ3pT7_auhB3uMuZSpBAsINOg2Rk.jpg","[Gallery] Rare Photos Of: Movin to the country"
"https://b.thumbs.redditmedia.com/n2BgekEr4hQhhYlNQ3pT7_auhB3uMuZSpBAsINOg2Rk.jpg","Movin to the country That Will Change Your Life"
"https://b.thumbs.redditmedia.com/n2BgekEr4hQhhYlNQ3pT7_auhB3uMuZSpBAsINOg2Rk.jpg","3 Things About Movin to the country That Will Surprise You"
"https://b.thumbs.redditmedia.com/HcAsPtBCcc3I17eV9bOHOcY_raK4KlsehQ7x5TwjtWc.jpg","[Pics]: Poor Akechi (@neggoartz)"
"https://b.thumbs.redditmedia.com/HcAsPtBCcc3I17eV9bOHOcY_raK4KlsehQ7x5TwjtWc.jpg","50 Facts About Poor Akechi (@neggoartz) You Never Knew"
"https://b.thumbs.redditmedia.com/6DeGOWSnKUAN3AEfS-cGhAr4GfrQOcqqShiOwaotXpk.jpg","The Truth About: This describes everyone in here… minus being economists"
"https://b.thumbs.redditmedia.com/TrJYBAnU2uVr25XgJXnEqopTLlerQeE4jllgPMNEHkA.jpg","10 Reasons Why Absolute kino"
"https://b.thumbs.redditmedia.com/baDxUag5pfJHRat36FEWics56e1nd0KuL-zpGNAJles.jpg","Doctors Hate This: A, E, I, O, U, and sometimes Y"
"https://external-preview.redd.it/ZTZvanV1eTlrYmdmMZkVymrfpa6Rx7w-MfHhUbHowcrZ97SUo6bp5sXw4u95.png?width=140&amp;height=140&amp;crop=140:140,smart&amp;format=jpg&amp;v=enabled&amp;lthumb=true&amp;s=f95b365a2e8b7803b260fd74052f53c84a8a230e","What Happened Next Will Amaze You: 🔥 Thirsty Manatee drinking fresh water as a guy rinses his boat off near St Pete, Florida."
"https://b.thumbs.redditmedia.com/3ShyEiG7ikPWe0wHZ2s0-YHdblMhMrrYyIWaRISSx1s.jpg","Incredible Story Of: It’s his 1st bday. Congratulate him"
"https://b.thumbs.redditmedia.com/3ShyEiG7ikPWe0wHZ2s0-YHdblMhMrrYyIWaRISSx1s.jpg","5 Things About It’s his 1st bday. Congratulate him That Will Surprise You"
"https://b.thumbs.redditmedia.com/A72T6JVNvmu5nWlx7zcHjcnpZSUwkFFH4f-MXUv3UNM.jpg","E-i-e-i-oh no You Never Knew Existed"
"https://b.thumbs.redditmedia.com/cSa3qyQXJX6_9jUM7o12kPZhm2u4ja0SsCC1_OhF5OQ.jpg","Doctors Hate This: McLaren tried to take the necessary precautions against the Rosberg selfie"
"https://b.thumbs.redditmedia.com/cSa3qyQXJX6_9jUM7o12kPZhm2u4ja0SsCC1_OhF5OQ.jpg","Top 50 McLaren tried to take the necessary precautions against the Rosberg selfie Moments"
"https://external-preview.redd.it/dzBpMjJjMXJyOWdmMVuo-XoD4uOZ7bucDNhWC_nUfKYJwYjEEqnI7Tzr9QAT.png?width=140&amp;height=140&amp;crop=140:140,smart&amp;format=jpg&amp;v=enabled&amp;lthumb=true&amp;s=3b79cbc057bf0dd97740bdd93615df2fae9fbe28","Amazing Secret Of: Regrets ordering table side carving."
"https://external-preview.redd.it/dzBpMjJjMXJyOWdmMVuo-XoD4uOZ7bucDNhWC_nUfKYJwYjEEqnI7Tzr9QAT.png?width=140&amp;height=140&amp;crop=140:140,smart&amp;format=jpg&amp;v=enabled&amp;lthumb=true&amp;s=3b79cbc057bf0dd97740bdd93615df2fae9fbe28","50 Facts About Regrets ordering table side carving. You Never Knew"
"https://external-preview.redd.it/aXRsbm1wMWJuYmdmMcRCBoEQvzCy-pVQgy2z6memiH4OT4VTR8zBvIGxyFOR.png?width=140&amp;height=140&amp;crop=140:140,smart&amp;format=jpg&amp;v=enabled&amp;lthumb=true&amp;s=1546a8df994e0827698c85c0ad0efe20daf30354","The Real Reason Behind: Wcgw speeding on tight city streets"
"https://external-preview.redd.it/aXRsbm1wMWJuYmdmMcRCBoEQvzCy-pVQgy2z6memiH4OT4VTR8zBvIGxyFOR.png?width=140&amp;height=140&amp;crop=140:140,smart&amp;format=jpg&amp;v=enabled&amp;lthumb=true&amp;s=1546a8df994e0827698c85c0ad0efe20daf30354","Wcgw speeding on tight city streets That Went Viral Overnight"
"https://external-preview.redd.it/tlH4fr9FnCYn1zwwbI3LeRfrkiKzbvdw0HblhwLI2PQ.jpeg?width=140&amp;height=93&amp;crop=140:93,smart&amp;auto=webp&amp;s=30fdfcb519f30de1f3651448ebc0de6d8adb09a4","Unbelievable Truth Behind: Paramount+ loses 1.3 Million subscribers."
"https://b.thumbs.redditmedia.com/5Fh1WNMwUSj-nYAaD_ApWS4vnKIgkFJegS0-HSk7s5w.jpg","People Are Going Crazy Over: Kindness Before the Cure 💖"
"https://b.thumbs.redditmedia.com/UEk7K7jgOs6Jfhus0B16FV7uFtYjrMHkFANN-5KqVGA.jpg","Are you ready to become an Alpha Male? 💪😤 Experts Are Talking About"
