image_url,title
"https://external-preview.redd.it/dmx0endtcmR0N2dmMdjaLDEuGvKRZaZo-A32m1IYD9XRTOBjp8gWK7d6N_oY.png?width=140&amp;height=140&amp;crop=140:140,smart&amp;format=jpg&amp;v=enabled&amp;lthumb=true&amp;s=83a0c3e9607db5724108ca1b55bc49c1d8e58f24","20 Things About Falling tree almost hits cyclist during severe weather That Will Surprise You"
"https://b.thumbs.redditmedia.com/gAFQ0IMVse2H7JKNDOL352OHjEGaDMcnq9CSnObsWYA.jpg","[Photos]: A baby born from an embryo frozen in 1994 has broken the record for the world's ""oldest baby"". Source in the comment."
"https://b.thumbs.redditmedia.com/gAFQ0IMVse2H7JKNDOL352OHjEGaDMcnq9CSnObsWYA.jpg","A baby born from an embryo frozen in 1994 has broken the record for the world's ""oldest baby"". Source in the comment. Everyone Is Obsessed With"
"https://external-preview.redd.it/dDJpdmFodGFoOGdmMdOe3DLundAbqKht17WTxXvOwYB6jU0Jbnqihh3P2qdj.png?width=140&amp;height=140&amp;crop=140:140,smart&amp;format=jpg&amp;v=enabled&amp;lthumb=true&amp;s=c7d73d76c6f903cc0d4b85956a7d43d044dd1191","Experts Don't Want You To Know: Using CRISPR technique, scientists can genetically modify mosquitoes by disabling a specific gene in females rendering them unable to pierce human skin."
"https://b.thumbs.redditmedia.com/0wlkmeGgXNw9Zo7ypsvAV2UILz_qvRUOcn76CZ5FCDs.jpg","The boardwalk wood isn’t getting wet around the screws That's Taking Over Social Media"
"https://b.thumbs.redditmedia.com/0wlkmeGgXNw9Zo7ypsvAV2UILz_qvRUOcn76CZ5FCDs.jpg","30 Facts About The boardwalk wood isn’t getting wet around the screws You Never Knew"
"https://external-preview.redd.it/aDB1N3o0bW1yYWdmMUsMte7QPut35lTEqfNBs9fQGRbO1RDG1kfrRvEjUHk-.png?width=140&amp;height=140&amp;crop=140:140,smart&amp;format=jpg&amp;v=enabled&amp;lthumb=true&amp;s=2e4e3e719002e6ea79579e6a8cc409ade7fb3e22","Incredible Story Of: Bro invented a new skateboard trick"
"https://b.thumbs.redditmedia.com/9RS2Evi4lpmkslPNlJiLo6KO3FHL-KI4l_EJ9Nwrz_c.jpg","[Gallery] Rare Photos Of: China cut a mountain in half to build a highway. Guizhou Province"
"https://a.thumbs.redditmedia.com/bs16784Tq8a4zzfxURADsxb6BaF3Dl6FtnA9jRCnT_0.jpg","3 Facts About Almost flat rainbow You Never Knew"
"https://b.thumbs.redditmedia.com/-kYHrI3jtPcubv7zVg4358s-A-aIAQJV2T71qy2-4xI.jpg","The Truth About: When the Icebergs Came to Town - Inaarsuit, Greenland"
"https://b.thumbs.redditmedia.com/J1-QNYH9pQD181I75ARsZF-sbwWE86uivJhCd7WLjRM.jpg","[Pics]: There are four seats, but the shadow only casts three due to the lighting."
"https://b.thumbs.redditmedia.com/PE0exGXMFfH8CQREpxRkiAmkF_u4QFS6AxzDoUsSoew.jpg","[Gallery] Rare Photos Of: Autochrome from the US in the 1910 to 1920s. Not modern colorized, this is natural color of the process at the time, before kodachromes."
"https://b.thumbs.redditmedia.com/PE0exGXMFfH8CQREpxRkiAmkF_u4QFS6AxzDoUsSoew.jpg","15 Secrets Behind Autochrome from the US in the 1910 to 1920s. Not modern colorized, this is natural color of the process at the time, before kodachromes."
"https://external-preview.redd.it/NGczNG1lYjBvOGdmMZ4kcmelb5R1_oEKy9W8G6D34xQEmVN-ffOc7GP4uqzl.png?width=140&amp;height=140&amp;crop=140:140,smart&amp;format=jpg&amp;v=enabled&amp;lthumb=true&amp;s=e0bd4343e5674171fc9955e59fbb9cd5143cc749","You Won't Believe: Once in a lifetime shot! Tried to play it off like he didn’t just get a fire take"
"https://external-preview.redd.it/Z292YTZhZ3J1N2dmMRY9ybT09KHQ_gThV64mC1rM_xl88tJrJIsVVCr0n47-.png?width=140&amp;height=140&amp;crop=140:140,smart&amp;format=jpg&amp;v=enabled&amp;lthumb=true&amp;s=3f86497e8ece5e6919006943d0ec0f2f20569fc0","10 Facts About Courage Adams World Record Nose Manual On A Treadmill You Never Knew"
"https://external-preview.redd.it/cjJrM29tZnZrYmdmMebwu3b68cCCZYF33rIeqKFIfha65zpGXUz3VMofNT70.png?width=140&amp;height=140&amp;crop=140:140,smart&amp;format=jpg&amp;v=enabled&amp;lthumb=true&amp;s=b9f77565774747afa0bd9a23f505916489ed02a9","This Changes Everything: Insanely satisfying juggling by Takehiro Nagaoka"
"https://external-preview.redd.it/cjJrM29tZnZrYmdmMebwu3b68cCCZYF33rIeqKFIfha65zpGXUz3VMofNT70.png?width=140&amp;height=140&amp;crop=140:140,smart&amp;format=jpg&amp;v=enabled&amp;lthumb=true&amp;s=b9f77565774747afa0bd9a23f505916489ed02a9","Insanely satisfying juggling by Takehiro Nagaoka Everyone Is Obsessed With"
"https://external-preview.redd.it/exgVuM3XRvTN0nQ_znqGg9sgQDx8ZpUOd5ugFP31Bcg.jpeg?width=140&amp;height=78&amp;crop=140:78,smart&amp;auto=webp&amp;s=f23039f2643c5456dc4fbc4c567a503533c92ee9","This Will Shock You: TIL the iPad was in development long before the iPhone, despite officially releasing 3 years after the iPhone."
"https://external-preview.redd.it/exgVuM3XRvTN0nQ_znqGg9sgQDx8ZpUOd5ugFP31Bcg.jpeg?width=140&amp;height=78&amp;crop=140:78,smart&amp;auto=webp&amp;s=f23039f2643c5456dc4fbc4c567a503533c92ee9","TIL the iPad was in development long before the iPhone, despite officially releasing 3 years after the iPhone. That Went Viral Overnight"
"https://b.thumbs.redditmedia.com/yYVTljJbazqoKhMDUguSDrWQZN1-zF5W0St36HgjeTA.jpg","Replica of 16th Century suit of armour created by Chris Gilman of Global Effects Inc, worn here by Adam Savage of Mythbusters fame. This intricate project took 20 years to complete That Went Viral Overnight"
"https://b.thumbs.redditmedia.com/yYVTljJbazqoKhMDUguSDrWQZN1-zF5W0St36HgjeTA.jpg","Top 20 Replica of 16th Century suit of armour created by Chris Gilman of Global Effects Inc, worn here by Adam Savage of Mythbusters fame. This intricate project took 20 years to complete Moments"
"https://external-preview.redd.it/b-Ehy5AhkSRE_OMPXqSIwu9T_axqvhZv9OGQAcNiKcU.jpeg?width=140&amp;height=140&amp;crop=140:140,smart&amp;auto=webp&amp;s=d1e4c1e4359ab401f9a62a77ddac9decf9869265","What Happened Next Will Amaze You: TIL some native Japanese have facial features linked to Jomon ancestry that are visually similar to those of Caucasians"
"https://external-preview.redd.it/b-Ehy5AhkSRE_OMPXqSIwu9T_axqvhZv9OGQAcNiKcU.jpeg?width=140&amp;height=140&amp;crop=140:140,smart&amp;auto=webp&amp;s=d1e4c1e4359ab401f9a62a77ddac9decf9869265","30 Reasons Why TIL some native Japanese have facial features linked to Jomon ancestry that are visually similar to those of Caucasians"
"https://a.thumbs.redditmedia.com/XhaU5cd2qvmMjQ50BoxpRS7lblJbP73Ndpd5oYWdfr0.jpg","Scientists Discover: I cracked this egg and it was full of blood"
"https://external-preview.redd.it/YTcwNzdmOWM4YmdmMVy1HA5-GL4vsY4lHv_Jr-8--0BWW6IkmRX47qhZd-OF.png?width=140&amp;height=76&amp;crop=140:76,smart&amp;format=jpg&amp;v=enabled&amp;lthumb=true&amp;s=6d9e706ad88a1b7d5d03e362160af8092f589b9e","Unbelievable Truth Behind: Nancy Cartwright - 36 seconds of genius"
"https://external-preview.redd.it/dzJ2NXJ4eW9wN2dmMWQpPT5B-hfWD_rWoALmgqYvhgfqeWXxDhoofHvwKROK.png?width=140&amp;height=140&amp;crop=140:140,smart&amp;format=jpg&amp;v=enabled&amp;lthumb=true&amp;s=29d9a302ec7f740e2d1614c277ce6177e8642d00","Mind-Blowing Facts About: An eagle casually flying off with a goat..!"
"https://external-preview.redd.it/bWd6cjdhN2Y1YWdmMTFHoroKcNSh_21ugy8oqPKUbTCNIpdc811rUV6kOeN1.png?width=140&amp;height=93&amp;crop=140:93,smart&amp;format=jpg&amp;v=enabled&amp;lthumb=true&amp;s=7c29f19b26ca6c1e95de768f3a5bc2f4c89c8a32","Incredible Story Of: A Conversation Between an American Soldier and an Iraqi Child in 2006."
"https://b.thumbs.redditmedia.com/8X7vLKd_Thtw6RE_XvY9VFulKMgWLmY-YGc2DaGF0qQ.jpg","100 inch subwoofer by German audio company Ascendo. Careful with that amp, Marty! That Will Change Your Life"
"https://external-preview.redd.it/N3J1b2tmZGdwNmdmMd40KxSo-Uu_bFdZCfXlSMfQHEv1dIWcXLNoaExP5yEw.png?width=140&amp;height=140&amp;crop=140:140,smart&amp;format=jpg&amp;v=enabled&amp;lthumb=true&amp;s=92af868112217c5e17e2c94ca0fb513347ffe6e7","[Gallery] Rare Photos Of: A marine blowhole, or geyser, forms when sea caves extend inland and upward into vertical shafts that open at the surface"
"https://external-preview.redd.it/N3J1b2tmZGdwNmdmMd40KxSo-Uu_bFdZCfXlSMfQHEv1dIWcXLNoaExP5yEw.png?width=140&amp;height=140&amp;crop=140:140,smart&amp;format=jpg&amp;v=enabled&amp;lthumb=true&amp;s=92af868112217c5e17e2c94ca0fb513347ffe6e7","A marine blowhole, or geyser, forms when sea caves extend inland and upward into vertical shafts that open at the surface Everyone Is Obsessed With"
"https://b.thumbs.redditmedia.com/_h9CQ1VyGwSNGjxsPYHy-woyF3oGmhSaVdRdY8gYYuk.jpg","What Happened Next Will Amaze You: Cameras in natural environments have captured rare and fascinating moments"
"https://a.thumbs.redditmedia.com/C_jSQVUDoOSm7xrIdEZIlI0MHy5ntV-ynatvmJVD8M8.jpg","Amazing Secret Of: My unopened water has a cap in it."
"https://external-preview.redd.it/c2pndGxmbnhrOGdmMVNHc9kav057xdXnDg6pW3_J__Fp4liav1pgsK44Iiya.png?width=140&amp;height=140&amp;crop=140:140,smart&amp;format=jpg&amp;v=enabled&amp;lthumb=true&amp;s=b513dc106e7f25982323bf8d1042374e68e993a7","You Won't Believe: The Veluwemeer Aqueduct allows sailboats to pass over vehicles"
"https://external-preview.redd.it/c2pndGxmbnhrOGdmMVNHc9kav057xdXnDg6pW3_J__Fp4liav1pgsK44Iiya.png?width=140&amp;height=140&amp;crop=140:140,smart&amp;format=jpg&amp;v=enabled&amp;lthumb=true&amp;s=b513dc106e7f25982323bf8d1042374e68e993a7","The Veluwemeer Aqueduct allows sailboats to pass over vehicles Everyone Is Obsessed With"
"https://a.thumbs.redditmedia.com/8--X9DGQIsUpsOsyS0HxoDjjSLLG4FuyOTZZnM_ZOk4.jpg","Doctors Hate This: China's 'most inconvenient convenience store' hangs off the side of a cliff, selling bottled water and snacks to parched climbers."
"https://a.thumbs.redditmedia.com/8--X9DGQIsUpsOsyS0HxoDjjSLLG4FuyOTZZnM_ZOk4.jpg","15 Secrets Behind China's 'most inconvenient convenience store' hangs off the side of a cliff, selling bottled water and snacks to parched climbers."
"https://external-preview.redd.it/b3RxanZuNmU2N2dmMVIg2zbP0AQLY8Ezt6f6OAI3fv4lcsdz7s0xIfFOmIZX.png?width=140&amp;height=78&amp;crop=140:78,smart&amp;format=jpg&amp;v=enabled&amp;lthumb=true&amp;s=69dfc5ff86fa769e8244de78f169aab93bea64fb","Amazing Secret Of: The stands' insane reaction to Messi dribbling"
"https://external-preview.redd.it/b3RxanZuNmU2N2dmMVIg2zbP0AQLY8Ezt6f6OAI3fv4lcsdz7s0xIfFOmIZX.png?width=140&amp;height=78&amp;crop=140:78,smart&amp;format=jpg&amp;v=enabled&amp;lthumb=true&amp;s=69dfc5ff86fa769e8244de78f169aab93bea64fb","Top 10 The stands' insane reaction to Messi dribbling Moments"
"https://external-preview.redd.it/IGDvxvSXAUI2_FAaYxHP8abJvTNU2qrPWgOKD4VAgt8.jpeg?width=140&amp;height=140&amp;crop=140:140,smart&amp;auto=webp&amp;s=dc52446ecc3e7269f7977cb34440f0176499b28e","The Secret Behind: TIL that the Colossus of Constantine, a 12-meter (40-foot) ancient statue of the Roman emperor, had two right hands"
"https://external-preview.redd.it/IGDvxvSXAUI2_FAaYxHP8abJvTNU2qrPWgOKD4VAgt8.jpeg?width=140&amp;height=140&amp;crop=140:140,smart&amp;auto=webp&amp;s=dc52446ecc3e7269f7977cb34440f0176499b28e","TIL that the Colossus of Constantine, a 12-meter (40-foot) ancient statue of the Roman emperor, had two right hands Will Leave You Speechless"
"https://external-preview.redd.it/YWw4dm9xb2FoYmdmMafulBdFyfo3QFsljHK31feuJpYf-vD5QEgxTyaIzszc.png?width=140&amp;height=140&amp;crop=140:140,smart&amp;format=jpg&amp;v=enabled&amp;lthumb=true&amp;s=1bd4b41292e18b81b4eeb4ee436286a5944754b3","Experts Don't Want You To Know: The Death's-head hawkmoth is a large, nocturnal moth with a wingspan of up to 120mm, its namesake marking on the thorax"
"https://external-preview.redd.it/YWw4dm9xb2FoYmdmMafulBdFyfo3QFsljHK31feuJpYf-vD5QEgxTyaIzszc.png?width=140&amp;height=140&amp;crop=140:140,smart&amp;format=jpg&amp;v=enabled&amp;lthumb=true&amp;s=1bd4b41292e18b81b4eeb4ee436286a5944754b3","50 Facts About The Death's-head hawkmoth is a large, nocturnal moth with a wingspan of up to 120mm, its namesake marking on the thorax You Never Knew"
"https://external-preview.redd.it/bWw0am9sZXpiYWdmMVOH6h9EBgVIvzOCAOL12cBVJpKEtkFwPifsi1gM_9bg.png?width=140&amp;height=140&amp;crop=140:140,smart&amp;format=jpg&amp;v=enabled&amp;lthumb=true&amp;s=4888766729ce2214c2e34ffef54e343c7e271b4d","This Simple Trick: Some of Gamze's best knife trick shots in one cut."
"https://external-preview.redd.it/NDd3ZWZ1cjRkOWdmMb7KdRjAIf-5s7jkIw5uSpB1IHiMgxrXopw_1j7DPcwB.png?width=140&amp;height=140&amp;crop=140:140,smart&amp;format=jpg&amp;v=enabled&amp;lthumb=true&amp;s=81ff1b80115ea4e97aceab48e16a48e0f740ffe3","Mind-Blowing Facts About: Little girl nonchalantly plays the piano, even controlling pitch with her foot"
"https://external-preview.redd.it/NDd3ZWZ1cjRkOWdmMb7KdRjAIf-5s7jkIw5uSpB1IHiMgxrXopw_1j7DPcwB.png?width=140&amp;height=140&amp;crop=140:140,smart&amp;format=jpg&amp;v=enabled&amp;lthumb=true&amp;s=81ff1b80115ea4e97aceab48e16a48e0f740ffe3","30 Facts About Little girl nonchalantly plays the piano, even controlling pitch with her foot You Never Knew"
"https://b.thumbs.redditmedia.com/6f_FGgQrUy_3jmVgaK5ysKHQcC2MTjNf-EZOIXvYzDQ.jpg","Doctors Hate This: A sandwich in Switzerland advertises “Recipe generated by AI” as a selling point, with Matrix-like visuals in the background"
"https://b.thumbs.redditmedia.com/6f_FGgQrUy_3jmVgaK5ysKHQcC2MTjNf-EZOIXvYzDQ.jpg","A sandwich in Switzerland advertises “Recipe generated by AI” as a selling point, with Matrix-like visuals in the background You Wish You Knew Sooner"
"https://b.thumbs.redditmedia.com/6f_FGgQrUy_3jmVgaK5ysKHQcC2MTjNf-EZOIXvYzDQ.jpg","3 Secrets Behind A sandwich in Switzerland advertises “Recipe generated by AI” as a selling point, with Matrix-like visuals in the background"
"https://b.thumbs.redditmedia.com/cXYRwg7YoKBZJYXSM3t1bpaiRORFfadFsjeyA00mmCg.jpg","30 Secrets Behind Tickle Me Elmo classified ads — New York Post, December 28, 1996"
"https://external-preview.redd.it/OGNqZ244MjQ5OWdmMZPYyZR8A2fXN_j2meRjca3QsGm3dtytaIVi-Zv0PkAr.png?width=140&amp;height=140&amp;crop=140:140,smart&amp;format=jpg&amp;v=enabled&amp;lthumb=true&amp;s=d0b57fa3bf83078fcfefec43ece6673769de060d","Top 3 A guy playing some music by burning gas inside tubes. Moments"
"https://external-preview.redd.it/anJhdzMxbnVlN2dmMftNdBd3eCBPfDhRt7WXQG0yzf7lwTG5BKdxGk6HVEve.png?width=140&amp;height=140&amp;crop=140:140,smart&amp;format=jpg&amp;v=enabled&amp;lthumb=true&amp;s=0c54ac3c9dec10c018fb80b315391b29863791ae","Shocking Discovery: An octopus camouflaged itself then sprays ink to confuse an eel hunting it"
"https://external-preview.redd.it/anJhdzMxbnVlN2dmMftNdBd3eCBPfDhRt7WXQG0yzf7lwTG5BKdxGk6HVEve.png?width=140&amp;height=140&amp;crop=140:140,smart&amp;format=jpg&amp;v=enabled&amp;lthumb=true&amp;s=0c54ac3c9dec10c018fb80b315391b29863791ae","7 Things About An octopus camouflaged itself then sprays ink to confuse an eel hunting it That Will Surprise You"
"https://b.thumbs.redditmedia.com/DYonBQ-82-AJXG87yxP-OmZJL11TXtuXLxifSW28A8I.jpg","You Won't Believe: The sky outside my house looks like a badly rendered video game"
"https://b.thumbs.redditmedia.com/VUPe0cUVMPxkY9SaFebbt14gFS4oqmIrXk_MSP_L8aw.jpg","This Simple Trick: 5 trees growing from a fallen tree in a neighbors backyard"
"https://external-preview.redd.it/amdmdDAzNXk4YmdmMUAiSQBvjQY-GbhCm7get7OdiJN1Eu2jmnzS8cmnnAvu.png?width=140&amp;height=140&amp;crop=140:140,smart&amp;format=jpg&amp;v=enabled&amp;lthumb=true&amp;s=6d5b9f40a29b63e80f96cc81aea15df033179fcd","[Pics]: Some amazing feats!"
"https://external-preview.redd.it/bnI3ZXRyNmc0NmdmMapNo1-33bK6cZaG3dEHVlNpUliydZTRbLN2iRhF8c4h.png?width=140&amp;height=122&amp;crop=140:122,smart&amp;format=jpg&amp;v=enabled&amp;lthumb=true&amp;s=369d3cd91b7b6a56dab1cbd10afab609ece88fa8","This Simple Trick: Older footage, an example of the speed and powerful destruction of a tsunami."
"https://b.thumbs.redditmedia.com/6qQlRanZPnIAj4yfNMEz18hQLJO-CqG_vZC-czQjops.jpg","Mind-Blowing Facts About: The CIA once ran a fake brothel where they secretly drugged men with LSD and watched through two-way mirrors. They called it Operation Midnight Climax."
"https://external-preview.redd.it/MzN0Mnp5YTB6YmdmMVtyQgMS6wwvN4RblovvuB-Bxirwl3KuJrmnFFXYNZYM.png?width=140&amp;height=140&amp;crop=140:140,smart&amp;format=jpg&amp;v=enabled&amp;lthumb=true&amp;s=c2ccb24160b52adc4f69f6fd37293fdc635637d6","Amazing Secret Of: Crazy illusions made by just moving shapes fluidly"
"https://external-preview.redd.it/MGxxNmplYWtiOWdmMczOaV8tVec3wfWmyrFDy34I9nYxddmOpQWd4k6Mqp47.png?width=140&amp;height=140&amp;crop=140:140,smart&amp;format=jpg&amp;v=enabled&amp;lthumb=true&amp;s=aa56ff7051e862ad66864b459970e2ece5ff9250","Reason #1,000 I'm NEVER Going to Australia You Never Knew Existed"
"https://external-preview.redd.it/MHFjNWhmYnN6OWdmMUm51e3z7g1eHfWm3frg0BSHwuM6liFxc7y7yOQhjJwa.png?width=140&amp;height=140&amp;crop=140:140,smart&amp;format=jpg&amp;v=enabled&amp;lthumb=true&amp;s=04522831c596c6a5601fd0a2dbc68b4fc55ed994","The Truth About: Why your energy bills are soaring"
"https://b.thumbs.redditmedia.com/bgNFU-xsPi-TvQo4DOojmrO0rg5LF_KuBFAFHO0W8MA.jpg","15 Secrets Behind Sponsorship cost for a F1 car in 1990"
"https://external-preview.redd.it/eXIxdzNybmhqN2dmMXvDY-h3CwblyC9ZM0ONivLMlBXgVGz9X3foTk4ngxNW.png?width=140&amp;height=78&amp;crop=140:78,smart&amp;format=jpg&amp;v=enabled&amp;lthumb=true&amp;s=866ce1a01c05cc8e88990770b49edcd9015e3ef4","What Happened Next Will Amaze You: Visuals from the new attraction Godzilla the Ride: Great Clash directed by Takashi Yamazaki at the Seibuen Amusement Park in Japan."
"https://external-preview.redd.it/eXIxdzNybmhqN2dmMXvDY-h3CwblyC9ZM0ONivLMlBXgVGz9X3foTk4ngxNW.png?width=140&amp;height=78&amp;crop=140:78,smart&amp;format=jpg&amp;v=enabled&amp;lthumb=true&amp;s=866ce1a01c05cc8e88990770b49edcd9015e3ef4","Visuals from the new attraction Godzilla the Ride: Great Clash directed by Takashi Yamazaki at the Seibuen Amusement Park in Japan. Everyone Is Obsessed With"
"https://external-preview.redd.it/P6i7PKLyMndSpsVdZfZDtsVXyoHGBJiJD_EdYOQuIEM.jpeg?width=140&amp;height=105&amp;crop=140:105,smart&amp;auto=webp&amp;s=e9a5392e1245ab891aa9b03169d27344054522de","Shocking Discovery: TIL that the driving force to build public drinking fountains in the western world was driven by the temperance movement"
"https://external-preview.redd.it/P6i7PKLyMndSpsVdZfZDtsVXyoHGBJiJD_EdYOQuIEM.jpeg?width=140&amp;height=105&amp;crop=140:105,smart&amp;auto=webp&amp;s=e9a5392e1245ab891aa9b03169d27344054522de","15 Things About TIL that the driving force to build public drinking fountains in the western world was driven by the temperance movement That Will Surprise You"
"https://b.thumbs.redditmedia.com/8-iW-ZzYPzRVRD3dMNed_RAIPKzmu4dr88lKKtEmouA.jpg","Shocking Discovery: There is a reason why people get ultrasounds instead of MRI's of their baby (MRI 1st pic) (Ultrasound 2nd Pic)"
"https://external-preview.redd.it/Y2Q5NDlxMzRmYWdmMdkhQlRE9JZN3JR0vmzMcdLqoWSfnlVtPkWsS_CgGp_U.png?width=140&amp;height=140&amp;crop=140:140,smart&amp;format=jpg&amp;v=enabled&amp;lthumb=true&amp;s=66b2af669658ac465e5ac159adfd8296da0b6bcd","Shocking Discovery: Applying gold to a frame"
"https://external-preview.redd.it/Y2Q5NDlxMzRmYWdmMdkhQlRE9JZN3JR0vmzMcdLqoWSfnlVtPkWsS_CgGp_U.png?width=140&amp;height=140&amp;crop=140:140,smart&amp;format=jpg&amp;v=enabled&amp;lthumb=true&amp;s=66b2af669658ac465e5ac159adfd8296da0b6bcd","Applying gold to a frame That Broke The Internet"
"https://via.placeholder.com/500x300/0066cc/ffffff?text=What's%20a%2090s%2F2000s%20trend%20that%20would%20baffle%20kids%20to","[Photos]: What's a 90s/2000s trend that would baffle kids today?"
"https://via.placeholder.com/500x300/0066cc/ffffff?text=Which%20U.S.%20state%20is%20the%20worst%20one%20to%20live%20in%3F","The Real Reason Behind: Which U.S. state is the worst one to live in?"
"https://via.placeholder.com/500x300/0066cc/ffffff?text=Which%20U.S.%20state%20is%20the%20worst%20one%20to%20live%20in%3F","Which U.S. state is the worst one to live in? That Everyone Should Know"
"https://via.placeholder.com/500x300/0066cc/ffffff?text=What's%20the%20subreddit%20with%20the%20weirdest%20name%20that%20t","7 Facts About What's the subreddit with the weirdest name that the regular person could never find that you think is pretty good ? You Never Knew"
"https://via.placeholder.com/500x300/0066cc/ffffff?text=Which%20celebrity%20were%20you%20most%20shocked%20to%20find%20out%20","Scientists Discover: Which celebrity were you most shocked to find out was actually putting on an American accent on screen?"
"https://via.placeholder.com/500x300/0066cc/ffffff?text=What%E2%80%99s%20the%20pettiest%20reason%20you%20wouldn%E2%80%99t%20be%20with%20so","5 Things About What’s the pettiest reason you wouldn’t be with someone? That Will Surprise You"
"https://via.placeholder.com/500x300/0066cc/ffffff?text=What%E2%80%99s%20a%20gross%20thing%20you%20secretly%20do%3F","Unbelievable Truth Behind: What’s a gross thing you secretly do?"
"https://via.placeholder.com/500x300/0066cc/ffffff?text=What%E2%80%99s%20a%20simple%20pleasure%20in%20your%20life%20that%20you%20wil","What’s a simple pleasure in your life that you will never get tired of? Experts Are Talking About"
"https://via.placeholder.com/500x300/0066cc/ffffff?text=What%20happened%20to%20Trump%E2%80%99s%20desire%20to%20takeover%20Greenl","People Are Going Crazy Over: What happened to Trump’s desire to takeover Greenland?"
"https://via.placeholder.com/500x300/0066cc/ffffff?text=What%20happened%20to%20Trump%E2%80%99s%20desire%20to%20takeover%20Greenl","7 Facts About What happened to Trump’s desire to takeover Greenland? You Never Knew"
"https://via.placeholder.com/500x300/0066cc/ffffff?text=Do%20you%20support%20banning%20social%20media%20for%20anyone%20und","Do you support banning social media for anyone under 14 y.o? why? That Will Change Your Life"
"https://via.placeholder.com/500x300/0066cc/ffffff?text=What%E2%80%99s%20the%20biggest%20problem%20in%20your%20life%20right%20now%3F","The Secret Behind: What’s the biggest problem in your life right now?"
"https://via.placeholder.com/500x300/0066cc/ffffff?text=What%E2%80%99s%20the%20biggest%20problem%20in%20your%20life%20right%20now%3F","7 Facts About What’s the biggest problem in your life right now? You Never Knew"
"https://via.placeholder.com/500x300/0066cc/ffffff?text=What%20is%20a%20fad%20that%20came%20in%20and%20was%20so%20popular%20and%20","Mind-Blowing Facts About: What is a fad that came in and was so popular and went out in the blink of an eye?"
"https://via.placeholder.com/500x300/0066cc/ffffff?text=What%20is%20a%20fad%20that%20came%20in%20and%20was%20so%20popular%20and%20","What is a fad that came in and was so popular and went out in the blink of an eye? That Will Change Your Life"
"https://via.placeholder.com/500x300/0066cc/ffffff?text=Whats%20the%20most%20attractive%20thing%20someone%20can%20do%20wit","You Won't Believe: Whats the most attractive thing someone can do without even touching you?"
"https://via.placeholder.com/500x300/0066cc/ffffff?text=People%20that%20have%20went%20years%20with%205%20hours%20of%20sleep%20","Amazing Secret Of: People that have went years with 5 hours of sleep or less, what impact has it had on your life?"
"https://via.placeholder.com/500x300/0066cc/ffffff?text=Now%20that%207%20out%20of%2012%20months%20are%20almost%20over%2C%20how%20i","[Pics]: Now that 7 out of 12 months are almost over, how is your 2025 going so far?"
"https://via.placeholder.com/500x300/0066cc/ffffff?text=What's%20the%20cruelest%20thing%20someone%20ever%20said%20to%20you","Experts Don't Want You To Know: What's the cruelest thing someone ever said to you that you still remember word for word?"
"https://via.placeholder.com/500x300/0066cc/ffffff?text=If%20your%20Salary%20is%20doubled%2C%20what%20will%20you%20do%20with%20t","This Changes Everything: If your Salary is doubled, what will you do with the extra Income?"
"https://via.placeholder.com/500x300/0066cc/ffffff?text=What%20are%20the%20most%20inaccurate%20things%20Hollywood%20show","Unbelievable Truth Behind: What are the most inaccurate things Hollywood shows about hacking?"
"https://via.placeholder.com/500x300/0066cc/ffffff?text=What%20has%20helped%20your%20mental%20health%20the%20most%3F","Doctors Hate This: What has helped your mental health the most?"
"https://via.placeholder.com/500x300/0066cc/ffffff?text=What%20has%20helped%20your%20mental%20health%20the%20most%3F","What has helped your mental health the most? That Broke The Internet"
"https://via.placeholder.com/500x300/0066cc/ffffff?text=What%20has%20helped%20your%20mental%20health%20the%20most%3F","20 Things About What has helped your mental health the most? That Will Surprise You"
"https://via.placeholder.com/500x300/0066cc/ffffff?text=What%20do%20non-Americans%20say%20to%20count%20exact%20seconds%2C%20","Mind-Blowing Facts About: What do non-Americans say to count exact seconds, like how Americans say ""One Mississipi""?"
"https://via.placeholder.com/500x300/0066cc/ffffff?text=Up%20to%20what%20level%20of%20family%20relation%20do%20you%20think%20i","This Changes Everything: Up to what level of family relation do you think it's still acceptable for a guy and a girl to be in a relationship?"
"https://via.placeholder.com/500x300/0066cc/ffffff?text=Up%20to%20what%20level%20of%20family%20relation%20do%20you%20think%20i","25 Things About Up to what level of family relation do you think it's still acceptable for a guy and a girl to be in a relationship? That Will Surprise You"
"https://via.placeholder.com/500x300/0066cc/ffffff?text=Turning%20the%20legal%20drinking%20age%20soon.%20What%20was%20your","Amazing Secret Of: Turning the legal drinking age soon. What was your crazy first legal drink story? How did it go?"
"https://via.placeholder.com/500x300/0066cc/ffffff?text=Turning%20the%20legal%20drinking%20age%20soon.%20What%20was%20your","Turning the legal drinking age soon. What was your crazy first legal drink story? How did it go? Will Leave You Speechless"
